Category,Question,Answer
General Information,What is syndicated research?,"Syndicated research is a type of market research where data and findings are collected and compiled by a research agency and then sold to multiple clients. It provides insights into consumer behavior, market trends, and product performance across various FMCG categories."
General Information,How often is the data updated?,"The data is typically updated on a monthly basis, with quarterly and annual summaries available. Real-time or weekly updates may also be available depending on the subscription level."
General Information,What FMCG categories are covered in this research?,"The research covers a wide range of FMCG categories, including: Food and Beverages (e.g., Snacks, soft drinks, dairy products), Personal Care (e.g., Skincare, haircare, oral care products), Household Cleaning (e.g., Detergents, surface cleaners, disinfectants), and Over-the-Counter Pharmaceuticals (e.g., Pain relievers, vitamins, supplements)."
General Information,Who can benefit from this syndicated research?,"This research is valuable for FMCG manufacturers, retailers, marketing agencies, and financial analysts looking to understand market dynamics, consumer preferences, and product performance."
General Information,What geographic regions are covered in this research?,"The research includes data from North America, Europe, Asia-Pacific, Latin America, and Africa, providing a comprehensive view of global consumer behavior."
General Information,Can I access historical data?,"Yes, historical data is available dating back up to 10 years, depending on the subscription plan. This allows for trend analysis over extended periods."
General Information,Is the data anonymized?,"Yes, all consumer data is anonymized to protect privacy, ensuring compliance with data protection regulations like GDPR."
General Information,How is syndicated research different from custom research?,"Syndicated research is standardized and sold to multiple clients, while custom research is tailored to the specific needs of one client. Syndicated research provides broad insights, whereas custom research delivers specific answers to particular business questions."
General Information,What is the sample size for global studies?,"For global studies, the sample size typically includes over 50,000 respondents, ensuring a representative sample across different regions and demographics."
General Information,Can I purchase individual reports?,"Yes, individual reports can be purchased without a subscription, providing access to specific insights without a long-term commitment."
General Information,How frequently are new categories added?,New categories are evaluated and added annually based on market demand and emerging consumer trends.
General Information,What types of businesses can benefit from this research?,"Businesses in retail, manufacturing, financial services, marketing, and consulting can all benefit from the insights provided by this syndicated research."
General Information,Can I share the reports within my organization?,"Yes, reports can be shared within your organization, but external distribution is restricted under the terms of the subscription agreement."
General Information,What is the scope of the data collection?,"The data collection covers both online and offline consumer purchase behavior, including in-store purchases, e-commerce transactions, and mobile app usage."
General Information,How are emerging markets represented in the research?,"Emerging markets are given special focus, with dedicated reports that highlight consumer behavior trends and market opportunities in these regions."
General Information,What is the methodology used for data collection?,"The data collection methodology includes a combination of surveys, POS data, loyalty card tracking, and social media analysis to provide a comprehensive view of consumer behavior."
General Information,Can I access raw data?,"Yes, raw data can be accessed through our advanced subscription plans, allowing for more detailed analysis and custom reporting."
General Information,Is there a demo available?,"Yes, a demo of the online portal and data access features can be arranged upon request, providing a preview of the platform's capabilities."
General Information,How does the research handle multi-channel shopping behavior?,"The research tracks multi-channel shopping behavior by integrating data from physical stores, online platforms, and mobile apps, providing a holistic view of consumer purchase patterns."
General Information,What industries are most covered in this research?,"The research primarily focuses on FMCG sectors such as food and beverages, personal care, household products, and over-the-counter pharmaceuticals, but also extends to retail and e-commerce."
Data Collection Methodology,How is consumer purchase behavior data collected?,"Data is collected through various methods, including: Point-of-Sale (POS) Data (collected from retailers' sales systems), Consumer Panels (information gathered from a representative group of consumers), Loyalty Card Data (tracking purchase behavior through retailer loyalty programs), and Online Purchase Tracking (data from e-commerce platforms and online transactions)."
Data Collection Methodology,What is the sample size of the consumer panel?,"The consumer panel consists of approximately 10,000 households, representing diverse demographic and geographic segments to ensure the data is reflective of the broader population."
Data Collection Methodology,How is data accuracy ensured?,"Data accuracy is ensured through: Cross-Referencing (comparing collected data with retailer reports), Quality Checks (regular validation of panel data), and Statistical Adjustments (applying corrections for non-response biases and other potential inaccuracies)."
Data Collection Methodology,How do you handle data from new or emerging categories?,"We continuously monitor the market for emerging categories and adjust our data collection methods accordingly. New categories are included in the research as they become relevant, ensuring comprehensive coverage."
Data Collection Methodology,What types of surveys are used in data collection?,"Surveys used in data collection include online surveys, telephone interviews, in-person focus groups, and mobile app-based surveys, ensuring comprehensive coverage of consumer opinions."
Data Collection Methodology,How is online shopping behavior tracked?,"Online shopping behavior is tracked through e-commerce transaction data, web analytics, and consumer surveys, providing insights into how consumers interact with online retailers."
Data Collection Methodology,What demographic data is included in the research?,"The research includes demographic data such as age, gender, income level, education, household size, and geographic location, allowing for detailed segmentation and analysis."
Data Collection Methodology,How frequently are surveys conducted?,"Surveys are conducted on a monthly basis, with additional surveys conducted during peak shopping seasons and in response to emerging trends."
Data Collection Methodology,How is loyalty card data used in the research?,"Loyalty card data is used to track individual consumer purchases, enabling analysis of brand loyalty, purchase frequency, and the impact of promotions on buying behavior."
Data Collection Methodology,How is data validated?,"Data validation involves cross-referencing survey responses with POS data, performing statistical checks for consistency, and applying data cleaning techniques to remove outliers."
Data Collection Methodology,What is the role of focus groups in data collection?,"Focus groups provide qualitative insights into consumer attitudes, preferences, and motivations, complementing the quantitative data collected through surveys and POS tracking."
Data Collection Methodology,How is mobile app usage tracked?,"Mobile app usage is tracked through app analytics, which monitor user interactions, in-app purchases, and engagement with promotional content, providing insights into mobile shopping behavior."
Data Collection Methodology,What is the geographic coverage of the data collection?,"Data is collected from urban, suburban, and rural areas across all major regions, ensuring comprehensive geographic coverage and representation of diverse consumer segments."
Data Collection Methodology,How is purchase frequency measured?,"Purchase frequency is measured by tracking the number of times a consumer buys a product within a specific time period, using data from POS systems, loyalty cards, and surveys."
Data Collection Methodology,What is the role of social media in data collection?,"Social media is analyzed to capture consumer sentiment, track brand mentions, and identify emerging trends, providing a real-time understanding of consumer attitudes and preferences."
Data Collection Methodology,How is household size factored into the research?,"Household size is factored into the research by segmenting data to understand how family size influences purchase behavior, product preferences, and shopping frequency."
Data Collection Methodology,How are promotional effects measured?,"Promotional effects are measured by comparing purchase behavior before, during, and after a promotion, using data from POS systems, loyalty cards, and consumer surveys."
Data Collection Methodology,How is data from different sources integrated?,"Data from different sources is integrated through data fusion techniques, which combine POS data, survey responses, and loyalty card data into a unified dataset for comprehensive analysis."
Data Collection Methodology,What data cleaning methods are used?,"Data cleaning methods include removing duplicates, correcting errors, standardizing formats, and imputing missing values to ensure data quality and accuracy."
Data Collection Methodology,How are outliers handled in the data?,Outliers are identified through statistical analysis and either corrected if they represent errors or flagged for further investigation if they represent unusual but valid behavior.
Data Collection Methodology,How is longitudinal data analysis conducted?,"Longitudinal data analysis is conducted by tracking the same set of consumers over time, allowing for the study of changes in behavior, preferences, and trends."
Data Collection Methodology,What is the role of behavioral economics in the research?,"Behavioral economics principles are applied to understand how psychological factors influence consumer decision-making, such as the impact of price framing, promotions, and social proof on purchases."
Data Collection Methodology,How are new product launches tracked?,"New product launches are tracked through POS data, consumer surveys, and social media analysis, providing insights into initial market reception, adoption rates, and competitive positioning."
Data Collection Methodology,How is repeat purchase behavior measured?,"Repeat purchase behavior is measured by tracking the frequency with which consumers buy the same product over time, using data from loyalty cards, surveys, and POS systems."
Data Collection Methodology,What methods are used for trend analysis?,"Trend analysis methods include time series analysis, moving averages, and regression models, allowing for the identification of long-term patterns and forecasting future trends."
Data Collection Methodology,How is seasonal variation accounted for in the data?,"Seasonal variation is accounted for by adjusting data to reflect changes in consumer behavior during holidays, back-to-school periods, and other seasonal events, ensuring accurate trend analysis."
Data Collection Methodology,How is brand loyalty measured?,"Brand loyalty is measured by analyzing repeat purchase rates, brand switching behavior, and consumer sentiment, using data from loyalty cards, surveys, and social media."
Data Collection Methodology,What role do in-store observations play in data collection?,"In-store observations provide qualitative insights into consumer behavior, such as product interaction, shopping patterns, and in-store decision-making, complementing quantitative data."
Data Collection Methodology,How is product trial behavior tracked?,"Product trial behavior is tracked by monitoring first-time purchases of new products, analyzing subsequent purchase behavior, and conducting follow-up surveys to assess consumer satisfaction."
Data Collection Methodology,How is competitive pricing data collected?,"Competitive pricing data is collected through store audits, POS data analysis, and online price tracking tools, allowing for the comparison of pricing strategies across brands."
Data Collection Methodology,What is the importance of respondent incentives in surveys?,"Respondent incentives, such as gift cards or discounts, are used to increase participation rates in surveys, ensuring a representative sample and higher data accuracy."
Data Collection Methodology,How are digital and traditional media interactions tracked?,"Digital and traditional media interactions are tracked through cross-media analysis, which examines how consumers engage with online ads, TV commercials, and print media, providing insights into media effectiveness."
Data Collection Methodology,What is the role of AI in data collection?,"AI plays a role in automating data collection processes, such as social media monitoring, sentiment analysis, and predictive modeling, allowing for more efficient and accurate data analysis."
Data Collection Methodology,How are customer journey maps created?,"Customer journey maps are created by analyzing consumer interactions across multiple touchpoints, including in-store visits, online browsing, and mobile app usage, providing a comprehensive view of the consumer experience."
Data Collection Methodology,How is product substitution behavior analyzed?,"Product substitution behavior is analyzed by tracking instances where consumers switch from one brand to another, often in response to price changes, promotions, or availability issues."
Data Collection Methodology,What is the impact of packaging on purchase behavior?,"The impact of packaging on purchase behavior is studied through consumer surveys, in-store observations, and sales data analysis, focusing on factors such as design, functionality, and sustainability."
Data Collection Methodology,How are out-of-stock situations monitored?,"Out-of-stock situations are monitored through POS data, retailer reports, and consumer feedback, providing insights into supply chain issues and the impact on brand loyalty."
Data Collection Methodology,How is the effectiveness of marketing campaigns measured?,"The effectiveness of marketing campaigns is measured by analyzing changes in brand awareness, purchase intent, and sales volume before, during, and after the campaign, using data from surveys, POS systems, and social media."
Data Collection Methodology,How are consumer preferences for sustainable products tracked?,"Consumer preferences for sustainable products are tracked through surveys, sales data, and social media analysis, focusing on factors such as eco-friendly packaging, organic ingredients, and ethical sourcing."
Data Collection Methodology,How is data collected from online marketplaces?,"Data from online marketplaces is collected through web scraping, transaction data analysis, and consumer reviews, providing insights into product performance, pricing strategies, and customer satisfaction."
Data Collection Methodology,What role does geolocation data play in consumer behavior analysis?,"Geolocation data is used to understand where consumers shop, how far they travel for purchases, and the impact of location-based promotions, enhancing the understanding of regional and local shopping patterns."
Data Collection Methodology,How is consumer behavior during economic downturns analyzed?,"Consumer behavior during economic downturns is analyzed by tracking changes in spending habits, product preferences, and brand loyalty, using data from surveys, POS systems, and economic indicators."
Data Collection Methodology,How are data privacy concerns addressed in the research?,"Data privacy concerns are addressed by anonymizing consumer data, obtaining consent for data collection, and complying with regulations such as GDPR, ensuring that consumer information is protected."
Data Collection Methodology,How are household expenditure patterns analyzed?,"Household expenditure patterns are analyzed by tracking spending across different product categories, income levels, and demographic segments, using data from surveys, POS systems, and loyalty cards."
Data Collection Methodology,How are consumer attitudes towards advertising measured?,"Consumer attitudes towards advertising are measured through surveys, focus groups, and social media analysis, examining factors such as ad recall, perceived relevance, and the influence on purchase intent."
Data Collection Methodology,How is the impact of product recalls monitored?,"The impact of product recalls is monitored through changes in sales volume, brand sentiment, and consumer trust, using data from POS systems, social media, and consumer surveys."
Data Collection Methodology,What methods are used to study impulse buying behavior?,"Impulse buying behavior is studied through in-store observations, sales data analysis, and consumer surveys, focusing on factors such as store layout, promotional displays, and product placement."
Data Collection Methodology,How is consumer feedback on product quality collected?,"Consumer feedback on product quality is collected through surveys, product reviews, and social media analysis, providing insights into consumer satisfaction and areas for improvement."
Data Collection Methodology,What is the role of psychographic data in the research?,"Psychographic data, such as lifestyle, values, and personality traits, is used to segment consumers and understand their motivations, preferences, and purchase behavior, complementing demographic data."
Data Collection Methodology,How is the impact of celebrity endorsements measured?,"The impact of celebrity endorsements is measured by analyzing changes in brand awareness, purchase intent, and sales volume, using data from surveys, social media, and POS systems."
Data Collection Methodology,How is consumer behavior during holidays analyzed?,"Consumer behavior during holidays is analyzed by tracking changes in spending patterns, product preferences, and shopping frequency, using data from POS systems, loyalty cards, and surveys."
Data Collection Methodology,How is consumer trust in brands measured?,"Consumer trust in brands is measured through surveys, brand sentiment analysis, and loyalty tracking, focusing on factors such as product quality, customer service, and ethical practices."
Data Collection Methodology,How are regional food preferences tracked?,"Regional food preferences are tracked through sales data, consumer surveys, and social media analysis, providing insights into local tastes, cultural influences, and seasonal variations."
Data Collection Methodology,How is data collected on consumer health and wellness trends?,"Data on consumer health and wellness trends is collected through surveys, sales data, and social media analysis, focusing on factors such as demand for organic products, fitness-related purchases, and dietary preferences."
Data Collection Methodology,How is data quality maintained across different markets?,"Data quality is maintained across different markets by applying consistent data collection methods, performing regular audits, and calibrating data to account for regional variations, ensuring reliable and comparable insights."
Data Collection Methodology,How is consumer behavior towards premium products analyzed?,"Consumer behavior towards premium products is analyzed by tracking purchase frequency, brand loyalty, and price sensitivity, using data from surveys, POS systems, and social media."
Data Collection Methodology,How are consumer preferences for local vs. global brands tracked?,"Consumer preferences for local vs. global brands are tracked through sales data, surveys, and social media analysis, providing insights into brand perception, loyalty, and regional variations."
Data Collection Methodology,What is the importance of data triangulation in the research?,"Data triangulation involves using multiple data sources, such as surveys, POS data, and social media, to cross-verify findings, ensuring accuracy and reliability in the research results."
Data Collection Methodology,How is consumer behavior during new product launches analyzed?,"Consumer behavior during new product launches is analyzed by tracking initial sales, repeat purchases, and consumer feedback, using data from POS systems, surveys, and social media."
Data Collection Methodology,How are demographic shifts accounted for in the research?,"Demographic shifts are accounted for by continuously updating the sample composition to reflect changes in population dynamics, ensuring that the research remains representative and relevant."
Data Collection Methodology,How is consumer behavior towards value-oriented products analyzed?,"Consumer behavior towards value-oriented products is analyzed by tracking purchase frequency, price sensitivity, and brand switching behavior, using data from POS systems, surveys, and loyalty cards."
Data Collection Methodology,How are seasonal trends in beverage consumption tracked?,"Seasonal trends in beverage consumption are tracked by analyzing sales data, consumer surveys, and weather patterns, providing insights into how factors such as temperature and holidays influence beverage preferences."
Data Collection Methodology,What is the role of experimental research in data collection?,"Experimental research involves testing specific hypotheses about consumer behavior through controlled experiments, such as A/B testing of product features, packaging designs, or promotional offers."
Data Collection Methodology,How is the impact of digital transformation on consumer behavior analyzed?,"The impact of digital transformation on consumer behavior is analyzed by tracking changes in online shopping habits, mobile app usage, and digital payment adoption, using data from web analytics, surveys, and POS systems."
Data Collection Methodology,How is consumer behavior towards eco-friendly products analyzed?,"Consumer behavior towards eco-friendly products is analyzed by tracking sales data, consumer surveys, and social media sentiment, focusing on factors such as packaging, ingredients, and sustainability practices."
Data Collection Methodology,How is consumer behavior during economic recovery periods analyzed?,"Consumer behavior during economic recovery periods is analyzed by tracking changes in spending patterns, brand loyalty, and product preferences, using data from surveys, POS systems, and economic indicators."
Data Collection Methodology,How are consumer preferences for convenience foods tracked?,"Consumer preferences for convenience foods are tracked through sales data, consumer surveys, and social media analysis, focusing on factors such as preparation time, packaging, and health claims."
Data Collection Methodology,How is the impact of trade promotions on consumer behavior analyzed?,"The impact of trade promotions on consumer behavior is analyzed by tracking changes in purchase frequency, brand switching, and stockpiling behavior, using data from POS systems, loyalty cards, and surveys."
Data Collection Methodology,How is the effectiveness of influencer marketing measured?,"The effectiveness of influencer marketing is measured by analyzing changes in brand awareness, purchase intent, and engagement metrics, using data from social media analytics, surveys, and sales data."
Data Collection Methodology,How are consumer attitudes towards digital payments tracked?,"Consumer attitudes towards digital payments are tracked through surveys, mobile app analytics, and transaction data, providing insights into the adoption of new payment methods and barriers to usage."
Data Collection Methodology,How is consumer behavior towards subscription services analyzed?,"Consumer behavior towards subscription services is analyzed by tracking subscription rates, renewal patterns, and customer satisfaction, using data from transaction records, surveys, and customer feedback."
Data Collection Methodology,How are consumer preferences for organic products tracked?,"Consumer preferences for organic products are tracked through sales data, consumer surveys, and social media analysis, focusing on factors such as health benefits, environmental impact, and price sensitivity."
Data Collection Methodology,How is the impact of loyalty programs on consumer behavior analyzed?,"The impact of loyalty programs on consumer behavior is analyzed by tracking changes in purchase frequency, brand loyalty, and redemption rates, using data from loyalty cards, surveys, and POS systems."
Data Collection Methodology,How is consumer behavior towards private label products analyzed?,"Consumer behavior towards private label products is analyzed by tracking sales data, brand switching behavior, and price sensitivity, using data from POS systems, surveys, and loyalty cards."
Data Collection Methodology,How is the impact of new regulations on consumer behavior analyzed?,"The impact of new regulations on consumer behavior is analyzed by tracking changes in product availability, pricing, and consumer perceptions, using data from surveys, POS systems, and industry reports."
