Question,Category,Document
What methods are utilized to analyze consumer behavior regarding health and wellness products?,Data Collection Methodology,8bc40b37
Which data sources contribute to the understanding of consumer trends in health and wellness?,Data Collection Methodology,8bc40b37
How do consumer surveys play a role in assessing behavior toward health-related products?,Data Collection Methodology,8bc40b37
In what ways does social media sentiment influence the analysis of consumer purchases?,Data Collection Methodology,8bc40b37
What specific factors are considered when investigating consumer behavior in the health sector?,Data Collection Methodology,8bc40b37
What methods are used to analyze the influence of online reviews on consumer choices?,Data Collection Methodology,4f553b5b
In what ways does the analysis of online reviews assess purchase intent?,Data Collection Methodology,4f553b5b
How are changes in brand perception evaluated through online review data?,Data Collection Methodology,4f553b5b
What types of data sources are utilized in the analysis of consumer behavior related to reviews?,Data Collection Methodology,4f553b5b
How does the analysis measure the impact of online reviews on sales volume?,Data Collection Methodology,4f553b5b
What methods are used to track consumer behavior regarding luxury items?,Data Collection Methodology,415db3d8
How do you measure factors like brand loyalty in your research?,Data Collection Methodology,415db3d8
What types of data sources contribute to your analysis of luxury product purchases?,Data Collection Methodology,415db3d8
Can you explain how price sensitivity is evaluated in your studies?,Data Collection Methodology,415db3d8
In what ways do surveys play a role in understanding consumer behavior for luxury goods?,Data Collection Methodology,415db3d8
What methods are used to analyze consumer behavior during the COVID-19 pandemic?,Data Collection Methodology,f26e597f
How do spending patterns change during the COVID-19 pandemic according to your analysis?,Data Collection Methodology,f26e597f
What kinds of data contribute to understanding consumer preferences during COVID-19?,Data Collection Methodology,f26e597f
How is shopping frequency tracked in your research during the pandemic?,Data Collection Methodology,f26e597f
Are economic indicators part of your analysis of consumer behavior related to COVID-19?,Data Collection Methodology,f26e597f
What methods are employed to examine the effects of e-commerce on consumer habits?,Data Collection Methodology,0a859ff1
How do you track shifts in online shopping behaviors related to e-commerce?,Data Collection Methodology,0a859ff1
Which data sources are utilized to assess digital payment adoption?,Data Collection Methodology,0a859ff1
How is mobile app usage measured in relation to e-commerce impacts?,Data Collection Methodology,0a859ff1
What role do web analytics play in analyzing consumer behavior changes?,Data Collection Methodology,0a859ff1
What methods are utilized to assess how social distancing has affected shopping habits?,Data Collection Methodology,a37ccfa1
In what ways are shifts in product choices examined concerning social distancing effects?,Data Collection Methodology,a37ccfa1
How is brand loyalty influenced during periods of social distancing according to your research?,Data Collection Methodology,a37ccfa1
What types of data sources are used to gather insights on consumer behavior during social distancing?,Data Collection Methodology,a37ccfa1
Can you explain how surveys contribute to understanding the impact of social distancing on consumers?,Data Collection Methodology,a37ccfa1
What methods are used to analyze changes in consumer behavior due to telecommuting?,Data Collection Methodology,48ef9c9f
How does the company track shifts in product preferences among consumers working from home?,Data Collection Methodology,48ef9c9f
In what ways are shopping frequency and spending patterns assessed in relation to telecommuting?,Data Collection Methodology,48ef9c9f
What sources of data are utilized to study the effects of telecommuting on consumers?,Data Collection Methodology,48ef9c9f
Are surveys and social media included in the data collection for telecommuting analysis?,Data Collection Methodology,48ef9c9f
What methods are used to analyze consumer behavior for plant-based products?,Data Collection Methodology,f5decffd
How does your research track sales data related to plant-based items?,Data Collection Methodology,f5decffd
In what ways are consumer surveys utilized in this analysis?,Data Collection Methodology,f5decffd
What aspects of social media sentiment are considered in your research?,Data Collection Methodology,f5decffd
Which factors influencing plant-based product choices are specifically examined?,Data Collection Methodology,f5decffd
What methodologies are used to assess how inflation affects consumer behavior?,Data Collection Methodology,fc53749b
In what ways are spending patterns monitored in relation to inflation?,Data Collection Methodology,fc53749b
How are product preferences studied amidst rising inflation rates?,Data Collection Methodology,fc53749b
What sources of data contribute to the analysis of price sensitivity?,Data Collection Methodology,fc53749b
How do surveys and POS systems play a role in understanding inflation's impact?,Data Collection Methodology,fc53749b
What methods are used to analyze the effect of supply chain disruptions on consumer habits?,Data Collection Methodology,b2015086
How do you track changes in product availability related to consumer behavior?,Data Collection Methodology,b2015086
What role do surveys play in understanding consumer reactions to supply chain issues?,Data Collection Methodology,b2015086
Can you explain how brand loyalty is measured in relation to supply chain disruptions?,Data Collection Methodology,b2015086
What types of data sources inform the analysis of purchase frequency during supply chain disruptions?,Data Collection Methodology,b2015086
What methods are used to track consumer behavior regarding digital products?,Data Collection Methodology,e2984c68
How do you determine purchase frequency in your analysis?,Data Collection Methodology,e2984c68
What tools do you utilize to gain insights into product preferences?,Data Collection Methodology,e2984c68
In what ways do surveys contribute to understanding brand loyalty?,Data Collection Methodology,e2984c68
How do web analytics play a role in your consumer behavior analysis?,Data Collection Methodology,e2984c68
What methods are used to track changes in shopping habits related to cross-border e-commerce?,Data Collection Methodology,2bf1f7b0
In what ways does the company assess product preferences influenced by cross-border e-commerce?,Data Collection Methodology,2bf1f7b0
How is brand loyalty evaluated in the context of cross-border e-commerce?,Data Collection Methodology,2bf1f7b0
What data sources are utilized to analyze the impact of cross-border e-commerce?,Data Collection Methodology,2bf1f7b0
How does social media play a role in understanding consumer behavior in cross-border shopping?,Data Collection Methodology,2bf1f7b0
What methods are used to analyze consumer behavior regarding sustainable packaging?,Data Collection Methodology,40b7dd93
Can you explain how sales data contributes to understanding consumer attitudes towards sustainable packaging?,Data Collection Methodology,40b7dd93
What role do consumer surveys play in the analysis of sustainable packaging preferences?,Data Collection Methodology,40b7dd93
How is social media sentiment measured in relation to consumer behavior on sustainable packaging?,Data Collection Methodology,40b7dd93
What specific factors are considered when studying consumer responses to sustainable packaging?,Data Collection Methodology,40b7dd93
What methods are used to analyze how product diversification affects consumer behavior?,Data Collection Methodology,8a59da2b
In what ways does brand loyalty factor into the analysis of product diversification?,Data Collection Methodology,8a59da2b
How do product preferences get evaluated in the context of consumer behavior?,Data Collection Methodology,8a59da2b
What types of data sources contribute to understanding purchase frequency?,Data Collection Methodology,8a59da2b
How is social media leveraged in the analysis of consumer behavior related to product diversification?,Data Collection Methodology,8a59da2b
What methodologies are employed to understand consumer behavior changes due to digital advertising?,Data Collection Methodology,4b4c60de
What specific metrics are observed to gauge the effect of digital advertising?,Data Collection Methodology,4b4c60de
In what ways is data collected to measure the influence of digital advertising?,Data Collection Methodology,4b4c60de
How do surveys contribute to the analysis of digital advertising's impact?,Data Collection Methodology,4b4c60de
What role do web analytics play in assessing consumer responses to digital ads?,Data Collection Methodology,4b4c60de
What methods are used to analyze consumer behavior regarding gluten-free products?,Data Collection Methodology,3fd7ef23
How do sales data contribute to understanding gluten-free product trends?,Data Collection Methodology,3fd7ef23
In what ways are consumer surveys utilized in the study of gluten-free products?,Data Collection Methodology,3fd7ef23
What role does social media sentiment play in analyzing gluten-free consumer behavior?,Data Collection Methodology,3fd7ef23
What specific factors are considered when assessing attitudes towards gluten-free items?,Data Collection Methodology,3fd7ef23
What is the process for accessing the syndicated research reports?,Data Access and Reporting,3e735ce7
Where can clients find the most recent updates of the reports?,Data Access and Reporting,3e735ce7
Is it possible to customize data extraction from the reports?,Data Access and Reporting,3e735ce7
Can I generate reports for presentations or internal use through the portal?,Data Access and Reporting,3e735ce7
What features does the online portal offer for data access?,Data Access and Reporting,3e735ce7
What different kinds of reports can I access through your service?,Data Access and Reporting,1040a32a
Can you explain what information is included in the Category Performance Summaries?,Data Access and Reporting,1040a32a
What insights are provided in the Consumer Demographic Analyses reports?,Data Access and Reporting,1040a32a
How do your Brand Loyalty Reports evaluate consumer attachment to brands?,Data Access and Reporting,1040a32a
What can I expect to learn from your Trend Forecasts regarding market outlook?,Data Access and Reporting,1040a32a
Is it possible to tailor the reports to my specific needs?,Data Access and Reporting,70bb4dd6
What factors can be adjusted when customizing the reports?,Data Access and Reporting,70bb4dd6
Can I select specific product categories for my report?,Data Access and Reporting,70bb4dd6
Are there options to focus the data on certain geographic areas?,Data Access and Reporting,70bb4dd6
Is it feasible to view data for different time periods like monthly or quarterly?,Data Access and Reporting,70bb4dd6
What types of training do you provide for using the data portal?,Data Access and Reporting,1803c608
Are there any resources available to assist with understanding the data portal?,Data Access and Reporting,1803c608
How can I participate in the training sessions for the data portal?,Data Access and Reporting,1803c608
Do you provide information on accessing webinars for the data portal?,Data Access and Reporting,1803c608
What kind of user guides do you offer for the data portal?,Data Access and Reporting,1803c608
What options are available for scheduling regular reports?,Data Access and Reporting,cb5e8d31
Can I set up reports to be generated automatically?,Data Access and Reporting,cb5e8d31
How often can I schedule reports to run?,Data Access and Reporting,cb5e8d31
"Is it possible to receive data updates daily, weekly, or monthly?",Data Access and Reporting,cb5e8d31
What should I do to ensure I always have the latest data available?,Data Access and Reporting,cb5e8d31
Is it possible to share reports with my team members?,Data Access and Reporting,71e57704
What method is available for sharing reports securely?,Data Access and Reporting,71e57704
Can I collaborate with colleagues on the reports?,Data Access and Reporting,71e57704
Are there any features to aid in decision-making within the portal?,Data Access and Reporting,71e57704
How do I access the sharing feature for reports?,Data Access and Reporting,71e57704
What types of file formats can I download my reports in?,Data Access and Reporting,98b276fc
Are there specific formats available for report downloads?,Data Access and Reporting,98b276fc
"Can I access my reports in PDF, Excel, or CSV formats?",Data Access and Reporting,98b276fc
What download options do you offer for reports?,Data Access and Reporting,98b276fc
How can I integrate downloaded data into my workflows?,Data Access and Reporting,98b276fc
What steps do I need to take to configure report alerts?,Data Access and Reporting,c307d5fd
How will I be notified when new reports are published?,Data Access and Reporting,c307d5fd
Can I set alerts based on specific data threshold criteria?,Data Access and Reporting,c307d5fd
Is there a way to keep track of important metrics through alerts?,Data Access and Reporting,c307d5fd
Are the report alerts customizable to suit my needs?,Data Access and Reporting,c307d5fd
Is there a mobile-compatible option for the data portal?,Data Access and Reporting,2983b3ff
Can I use my smartphone to access reports from the data portal?,Data Access and Reporting,2983b3ff
Will I be able to run queries on my tablet while away from my computer?,Data Access and Reporting,2983b3ff
Does the data portal support access from mobile devices?,Data Access and Reporting,2983b3ff
Is it possible to view reports while on the move using a mobile device?,Data Access and Reporting,2983b3ff
What is the process for designing a custom report template?,Data Access and Reporting,a944560a
Can you explain how I can save a custom report template for later use?,Data Access and Reporting,a944560a
In what ways can I select data points for my custom report template?,Data Access and Reporting,a944560a
Are there specific layout options available when creating a custom report template?,Data Access and Reporting,a944560a
Is it possible to modify an existing custom report template for future reports?,Data Access and Reporting,a944560a
Is it possible to export raw data directly from the portal?,Data Access and Reporting,e3183156
What formats are available for exporting raw data?,Data Access and Reporting,e3183156
Can I use tools of my choice to analyze the exported data?,Data Access and Reporting,e3183156
Will I be able to obtain raw data in CSV format?,Data Access and Reporting,e3183156
Is Excel one of the options for exporting data from the portal?,Data Access and Reporting,e3183156
What steps do I need to follow to initiate automated data exports?,Data Access and Reporting,9e0ba92e
Is there a specific feature in the portal that facilitates scheduling for data exports?,Data Access and Reporting,9e0ba92e
Can I receive the automated updates via my email or another method?,Data Access and Reporting,9e0ba92e
Does the system support exports to an FTP server as well?,Data Access and Reporting,9e0ba92e
How frequently can I schedule the automated data exports?,Data Access and Reporting,9e0ba92e
What types of visualization options can I find in the portal for data analysis?,Data Access and Reporting,2a5a2c87
Are there specific tools available for presenting data within the portal?,Data Access and Reporting,2a5a2c87
Can you list the visualization formats offered in the portal?,Data Access and Reporting,2a5a2c87
How do the visualization tools in the portal assist with data presentation?,Data Access and Reporting,2a5a2c87
What kind of graphs and charts can I use in the portal to analyze my data?,Data Access and Reporting,2a5a2c87
What steps do I need to follow to create a dashboard within the portal?,Data Access and Reporting,67429898
Is there a way to customize the layout of my dashboard?,Data Access and Reporting,67429898
How can I choose the key metrics that I want to monitor in my dashboard?,Data Access and Reporting,67429898
"Once I've arranged my dashboard, can I save that layout for future use?",Data Access and Reporting,67429898
Can I access my saved dashboard quickly after creating it?,Data Access and Reporting,67429898
Is it possible to combine portal data with data from other BI applications?,Data Access and Reporting,b0ce4e81
What types of BI tools can be integrated with the portal for enhanced analysis?,Data Access and Reporting,b0ce4e81
Can I use my current BI software with the portal's data?,Data Access and Reporting,b0ce4e81
Are there specific BI tools that work best with the portal?,Data Access and Reporting,b0ce4e81
Will integrating portal data with BI tools improve my data analysis?,Data Access and Reporting,b0ce4e81
What steps are involved in granting access to my team members?,Data Access and Reporting,06bc7c4a
Can I set different permission levels for each team member?,Data Access and Reporting,06bc7c4a
Is there a way to revoke access once it's been granted?,Data Access and Reporting,06bc7c4a
How many user accounts can I create for my team?,Data Access and Reporting,06bc7c4a
Are there any restrictions on what data can be viewed or edited by team members?,Data Access and Reporting,06bc7c4a
What kind of assistance can I expect for my custom queries?,Data Access and Reporting,f9708bb2
Is there a support team dedicated to helping with custom queries?,Data Access and Reporting,f9708bb2
How can I get help in structuring my queries effectively?,Data Access and Reporting,f9708bb2
What troubleshooting options are provided for issues with custom queries?,Data Access and Reporting,f9708bb2
Can I receive guidance from your team regarding custom data queries?,Data Access and Reporting,f9708bb2
What steps do I need to follow to export a report in PDF format?,Data Access and Reporting,0254073c
Is there a specific option I should look for in the portal's report viewer for exporting?,Data Access and Reporting,0254073c
Can I create print-ready documents from the reports I generate?,Data Access and Reporting,0254073c
What file format is available for exporting reports?,Data Access and Reporting,0254073c
Is the export feature accessible for all users in the portal?,Data Access and Reporting,0254073c
Is it possible to configure data feeds for instant updates?,Data Access and Reporting,c2c60aaa
Will I receive continuous updates through the data feeds?,Data Access and Reporting,c2c60aaa
How can I ensure I have the most current data available?,Data Access and Reporting,c2c60aaa
Can the data feeds integrate seamlessly with my existing systems?,Data Access and Reporting,c2c60aaa
What is the process for establishing real-time data feeds?,Data Access and Reporting,c2c60aaa
What options do I have for modifying the structure of my reports?,Data Access and Reporting,ca1ce9dd
Are there ways to change the size of columns in the report?,Data Access and Reporting,ca1ce9dd
Can I add or take out specific data points in the report?,Data Access and Reporting,ca1ce9dd
Is it possible to personalize the appearance of my reports?,Data Access and Reporting,ca1ce9dd
How do I rearrange elements within the report layout?,Data Access and Reporting,ca1ce9dd
In what ways can the data contribute to understanding consumer behavior and preferences for my business?,Data Usage and Application,0c077434
How does the data allow me to identify and leverage market trends effectively?,Data Usage and Application,0c077434
Can the data provide insights into the performance of my products in the current market?,Data Usage and Application,0c077434
In what manner can the data assist in enhancing my marketing strategies?,Data Usage and Application,0c077434
What specific consumer insights can I gain from utilizing this data?,Data Usage and Application,0c077434
Is it permissible to utilize the data for evaluating competition?,Data Usage and Application,08b29520
Can the data assist in assessing how my brand measures up against others?,Data Usage and Application,08b29520
Will this data help me understand shifts in market share?,Data Usage and Application,08b29520
How can I identify potential growth opportunities using this data?,Data Usage and Application,08b29520
What specific analytical comparisons can I conduct with this data?,Data Usage and Application,08b29520
What methods are employed to address seasonal differences in consumer purchasing habits?,Data Usage and Application,be4fa20b
In what ways do holiday seasons influence the research findings?,Data Usage and Application,be4fa20b
How are variations in weather taken into consideration in the data analysis?,Data Usage and Application,be4fa20b
Are there additional seasonal influences factored into the research beyond holidays and weather?,Data Usage and Application,be4fa20b
What specific time periods are identified as critical for analyzing consumer behavior changes?,Data Usage and Application,be4fa20b
Which industries stand to gain the most from this research?,Data Usage and Application,4a15e959
How can retailers use the insights provided by this research?,Data Usage and Application,4a15e959
In what ways can manufacturers benefit from the findings?,Data Usage and Application,4a15e959
What advantages does this research offer to the advertising sector?,Data Usage and Application,4a15e959
How can the finance industry leverage the data from this research?,Data Usage and Application,4a15e959
In what ways can the data assist in enhancing product development strategies?,Data Usage and Application,be4e6a0a
How does this data help in understanding consumer preferences for new products?,Data Usage and Application,be4e6a0a
Can you explain how emerging trends are identified through your research?,Data Usage and Application,be4e6a0a
What role does the data play in addressing unmet needs in the market?,Data Usage and Application,be4e6a0a
How can the insights gained from your data influence our target audience engagement?,Data Usage and Application,be4e6a0a
How can the data assist in developing a pricing strategy?,Data Usage and Application,befcc6a1
In what ways can I assess price sensitivity using the data?,Data Usage and Application,befcc6a1
Can this data provide insights into competitive pricing tactics?,Data Usage and Application,befcc6a1
Is it possible to evaluate consumer willingness to pay with this data?,Data Usage and Application,befcc6a1
How does this data contribute to optimizing pricing models?,Data Usage and Application,befcc6a1
In what ways can this data enhance our marketing strategies and approaches?,Data Usage and Application,586e8840
How does this data help in audience segmentation for targeted marketing?,Data Usage and Application,586e8840
What methods are available for assessing the effectiveness of marketing channels using this data?,Data Usage and Application,586e8840
Can this data facilitate real-time performance tracking of marketing campaigns?,Data Usage and Application,586e8840
What specific insights can we gain from the data to improve our marketing efforts?,Data Usage and Application,586e8840
How can the data influence my decision on market entry strategies?,Data Usage and Application,f5896318
In what ways does the research cover consumer behavior?,Data Usage and Application,f5896318
What insights can I gain regarding market size from the data?,Data Usage and Application,f5896318
How does the competitive landscape information aid in market entry?,Data Usage and Application,f5896318
Can this data help assess the feasibility of entering new markets?,Data Usage and Application,f5896318
In what ways can data from your research enhance the performance of my supply chain?,Data Usage and Application,9d2907e0
Could you explain how your data helps in predicting future demand for products?,Data Usage and Application,9d2907e0
What specific techniques are used to identify potential bottlenecks within the supply chain?,Data Usage and Application,9d2907e0
How does your data support optimizing inventory levels effectively?,Data Usage and Application,9d2907e0
Can you clarify how this information ensures product availability at the right time and location?,Data Usage and Application,9d2907e0
Is there a way to use this data to categorize different customer groups?,Data Usage and Application,7fbf5c5a
Can the data assist in dividing customers according to their buying habits?,Data Usage and Application,7fbf5c5a
How can the research help refine marketing strategies for specific customers?,Data Usage and Application,7fbf5c5a
Are demographics included in the factors for segmenting customers?,Data Usage and Application,7fbf5c5a
What aspect of customer behavior does the data analyze for better targeting?,Data Usage and Application,7fbf5c5a
In what ways can this data be utilized for improving customer retention strategies?,Data Usage and Application,2a19edc3
How does the analysis of loyalty trends contribute to customer retention efforts?,Data Usage and Application,2a19edc3
What methods can be employed to identify at-risk customers using this data?,Data Usage and Application,2a19edc3
How can targeted retention campaigns be developed based on data insights?,Data Usage and Application,2a19edc3
What role does data analysis play in enhancing customer loyalty and retention?,Data Usage and Application,2a19edc3
How can I utilize this data to enhance our corporate social responsibility efforts?,Data Usage and Application,7c12fde7
Is there a way to measure consumer perspectives on sustainability with this data?,Data Usage and Application,7c12fde7
Can the research help in aligning our CSR initiatives with what consumers value?,Data Usage and Application,7c12fde7
