Question,Category,Document
What formats are available for exporting custom query results?,Data Segmentation and Custom Queries,1d248554
Is it possible to integrate exported data into reports?,Data Segmentation and Custom Queries,1d248554
Can I transform custom queries into PDF files?,Data Segmentation and Custom Queries,1d248554
Are Excel and CSV options included for exporting data?,Data Segmentation and Custom Queries,1d248554
How do I make use of exported custom query data in presentations?,Data Segmentation and Custom Queries,1d248554
Is it possible to collaborate with my team using custom queries?,Data Segmentation and Custom Queries,be0006ae
How can I share my custom queries with other team members?,Data Segmentation and Custom Queries,be0006ae
Are there tools available for data analysis within the portal?,Data Segmentation and Custom Queries,be0006ae
Can several users work on data analysis simultaneously?,Data Segmentation and Custom Queries,be0006ae
What features support team collaboration on custom queries?,Data Segmentation and Custom Queries,be0006ae
What steps should I follow to filter data by product category in your portal?,Data Segmentation and Custom Queries,310bdcc3
Can you explain how to select specific product categories while using the portal?,Data Segmentation and Custom Queries,310bdcc3
Which product categories are available for filtering in your research data?,Data Segmentation and Custom Queries,310bdcc3
"Is it possible to analyze data specifically for snacks, beverages, or personal care products?",Data Segmentation and Custom Queries,310bdcc3
What types of custom queries can I create based on product category filtering?,Data Segmentation and Custom Queries,310bdcc3
What demographic segments can I analyze to understand consumer behavior better?,Data Segmentation and Custom Queries,f6f22def
Which demographic characteristics are typically included in your syndicated research?,Data Segmentation and Custom Queries,f6f22def
Can you list the key demographic segments that are part of your coverage?,Data Segmentation and Custom Queries,f6f22def
What specific demographic information do you provide for detailed analysis?,Data Segmentation and Custom Queries,f6f22def
How do common demographic segments help in understanding consumer trends?,Data Segmentation and Custom Queries,f6f22def
Is it possible to analyze consumer behavior differences across regions?,Data Segmentation and Custom Queries,cc775120
What tools do I need to apply geographic filters for my queries?,Data Segmentation and Custom Queries,cc775120
Can I see regional variations in data through the custom query feature?,Data Segmentation and Custom Queries,cc775120
How do I set up comparisons for different geographic areas?,Data Segmentation and Custom Queries,cc775120
Are there specific techniques for interpreting regional data comparisons?,Data Segmentation and Custom Queries,cc775120
What is the process to create a cross-tabulation in the research portal?,Data Segmentation and Custom Queries,9c5c3a08
Which variables can I compare when setting up a cross-tabulation?,Data Segmentation and Custom Queries,9c5c3a08
Can I generate visual representations such as tables or charts for my cross-tabulations?,Data Segmentation and Custom Queries,9c5c3a08
How do I access the cross-tabulation feature in the portal?,Data Segmentation and Custom Queries,9c5c3a08
Is it possible to examine relationships between demographic factors like brand preference and age group?,Data Segmentation and Custom Queries,9c5c3a08
Is it possible to segment data based on different time periods for analysis?,Data Segmentation and Custom Queries,6aad0bcd
Can I examine trends over specific months or years using your data?,Data Segmentation and Custom Queries,6aad0bcd
Will I be able to compare results across various time frames with the data?,Data Segmentation and Custom Queries,6aad0bcd
Are there options to filter data for specific quarters in my analysis?,Data Segmentation and Custom Queries,6aad0bcd
How flexible is the time filtering for the data provided in your research?,Data Segmentation and Custom Queries,6aad0bcd
What variables can be used to segment consumer behavior in your research?,Data Segmentation and Custom Queries,607c61d3
How can understanding consumer segments help in strategy development?,Data Segmentation and Custom Queries,607c61d3
Can you explain the importance of brand loyalty in data segmentation?,Data Segmentation and Custom Queries,607c61d3
What role do promotions play in analyzing consumer behavior?,Data Segmentation and Custom Queries,607c61d3
Is there a particular method to assess purchase frequency among consumers?,Data Segmentation and Custom Queries,607c61d3
Is it possible to tailor the variables in my custom query?,Data Segmentation and Custom Queries,48c885a7
What specific data points can I choose when customizing a query?,Data Segmentation and Custom Queries,48c885a7
Can I select demographic information when creating a custom query?,Data Segmentation and Custom Queries,48c885a7
Are there options to analyze purchase behavior in my custom query?,Data Segmentation and Custom Queries,48c885a7
How can I include product preferences in my custom query?,Data Segmentation and Custom Queries,48c885a7
What steps do I need to take to establish a recurring query in the portal?,Data Segmentation and Custom Queries,e45fd2fc
"Can I choose how often my query runs, such as daily or weekly?",Data Segmentation and Custom Queries,e45fd2fc
Is it possible to configure the parameters for a recurring query?,Data Segmentation and Custom Queries,e45fd2fc
How can I automate the running of my queries at specific intervals?,Data Segmentation and Custom Queries,e45fd2fc
Where can I find the options to schedule my query for automatic execution?,Data Segmentation and Custom Queries,e45fd2fc
Is it possible to use custom queries for making forecasts?,Data Segmentation and Custom Queries,8ccef398
How can historical data be utilized in custom queries for forecasting?,Data Segmentation and Custom Queries,8ccef398
What types of trends can be identified using custom queries?,Data Segmentation and Custom Queries,8ccef398
Can custom queries assist in projections like sales forecasts?,Data Segmentation and Custom Queries,8ccef398
What kind of future projections can benefit from analyzing past data?,Data Segmentation and Custom Queries,8ccef398
What options are available for income level filtering in the portal?,Data Segmentation and Custom Queries,94baf9f4
How can I specify which income segments to analyze?,Data Segmentation and Custom Queries,94baf9f4
Is it possible to focus on specific income groups when reviewing data?,Data Segmentation and Custom Queries,94baf9f4
What income categories can I choose from while filtering data?,Data Segmentation and Custom Queries,94baf9f4
"Can I analyze low, middle, or high-income segments separately?",Data Segmentation and Custom Queries,94baf9f4
What types of predictive modeling does your platform support?,Advanced Analytics and Predictive Modeling,f0721077
Can I forecast consumer behavior using your analytics tools?,Advanced Analytics and Predictive Modeling,f0721077
Is it possible to estimate future demand for products with your platform?,Advanced Analytics and Predictive Modeling,f0721077
Does the platform allow for sales projections based on various scenarios?,Advanced Analytics and Predictive Modeling,f0721077
What historical data is used for predictive analytics on your platform?,Advanced Analytics and Predictive Modeling,f0721077
Is it possible to apply machine learning techniques to the provided data?,Advanced Analytics and Predictive Modeling,e091e2e7
What kind of machine learning models can I import for analysis?,Advanced Analytics and Predictive Modeling,e091e2e7
Can I utilize historical data for training my machine learning models?,Advanced Analytics and Predictive Modeling,e091e2e7
Will the platform allow me to simulate different scenarios with the data?,Advanced Analytics and Predictive Modeling,e091e2e7
What features support testing scenarios for future trend analysis?,Advanced Analytics and Predictive Modeling,e091e2e7
What kinds of consumer feedback data can be analyzed for sentiment?,Advanced Analytics and Predictive Modeling,9b54669d
How can I use sentiment analysis to evaluate product reviews?,Advanced Analytics and Predictive Modeling,9b54669d
In what ways can sentiment analysis help me track brand perception?,Advanced Analytics and Predictive Modeling,9b54669d
Can sentiment analysis assist in identifying emerging trends in consumer behavior?,Advanced Analytics and Predictive Modeling,9b54669d
How does tracking consumer sentiment change over time benefit my business?,Advanced Analytics and Predictive Modeling,9b54669d
What steps are involved in creating a predictive model through your platform?,Advanced Analytics and Predictive Modeling,a975370b
Which types of models can I choose from when setting up a predictive analysis?,Advanced Analytics and Predictive Modeling,a975370b
"Can I utilize historical data for training a predictive model, and if so, how?",Advanced Analytics and Predictive Modeling,a975370b
Is there a specific section in the portal where I can select data variables for analysis?,Advanced Analytics and Predictive Modeling,a975370b
How do regression and classification differ in the context of predictive modeling?,Advanced Analytics and Predictive Modeling,a975370b
Is there an option to export the findings from predictive models?,Advanced Analytics and Predictive Modeling,669cc9c7
What formats are available for exporting predictive model results?,Advanced Analytics and Predictive Modeling,669cc9c7
Can I share the results of my predictive analysis with my team?,Advanced Analytics and Predictive Modeling,669cc9c7
Are the exported results suitable for inclusion in reports?,Advanced Analytics and Predictive Modeling,669cc9c7
Do exported results support formats like Excel and PDF?,Advanced Analytics and Predictive Modeling,669cc9c7
What methods are used in predictive modeling for sales forecasting?,Advanced Analytics and Predictive Modeling,eb318733
How does historical sales data contribute to sales projections?,Advanced Analytics and Predictive Modeling,eb318733
Can changes in pricing influence the accuracy of sales forecasts?,Advanced Analytics and Predictive Modeling,eb318733
What role do promotional activities play in predictive modeling?,Advanced Analytics and Predictive Modeling,eb318733
How are different scenarios accounted for in sales forecasting analysis?,Advanced Analytics and Predictive Modeling,eb318733
Is it possible to tailor predictive models to my requirements?,Advanced Analytics and Predictive Modeling,6ad76a3e
What options do I have for selecting variables in predictive models?,Advanced Analytics and Predictive Modeling,6ad76a3e
Can I choose different algorithms when creating predictive models?,Advanced Analytics and Predictive Modeling,6ad76a3e
How can I align the predictive analysis with my business objectives?,Advanced Analytics and Predictive Modeling,6ad76a3e
Are there ways to modify the predictive models based on my specific needs?,Advanced Analytics and Predictive Modeling,6ad76a3e
What methods can I use to ensure the predictions of my model are accurate?,Advanced Analytics and Predictive Modeling,a49fc353
How can I compare the outcomes of my predictive model to real results?,Advanced Analytics and Predictive Modeling,a49fc353
Are there specific techniques to validate predictive model performance?,Advanced Analytics and Predictive Modeling,a49fc353
What performance metrics should I consider for evaluating accuracy?,Advanced Analytics and Predictive Modeling,a49fc353
What is the role of cross-validation in assessing a predictive model?,Advanced Analytics and Predictive Modeling,a49fc353
How can predictive modeling assist in managing inventory effectively?,Advanced Analytics and Predictive Modeling,1890ef2b
What type of data is required to implement predictive modeling for inventory purposes?,Advanced Analytics and Predictive Modeling,1890ef2b
In what ways can predictive modeling help prevent stockouts in my inventory?,Advanced Analytics and Predictive Modeling,1890ef2b
Are there specific trends that predictive modeling can help identify for my product demand?,Advanced Analytics and Predictive Modeling,1890ef2b
Can predictive modeling improve decision-making processes related to inventory management?,Advanced Analytics and Predictive Modeling,1890ef2b
What types of visual representations can I use for predictive modeling results?,Advanced Analytics and Predictive Modeling,2ea2a566
How does the platform assist in visualizing predictive model outcomes?,Advanced Analytics and Predictive Modeling,2ea2a566
What specific data visualization tools are included in your analytics platform?,Advanced Analytics and Predictive Modeling,2ea2a566
In what ways can I use graphs to communicate my analysis findings?,Advanced Analytics and Predictive Modeling,2ea2a566
Which charts are available for visualizing data in the context of predictive modeling?,Advanced Analytics and Predictive Modeling,2ea2a566
In what ways does machine learning enhance consumer segmentation strategies?,Advanced Analytics and Predictive Modeling,a685bc76
How does analyzing large datasets contribute to better consumer segmentation?,Advanced Analytics and Predictive Modeling,a685bc76
What kind of data does machine learning utilize for improving segmentation?,Advanced Analytics and Predictive Modeling,a685bc76
Can you explain how patterns in consumer behavior are identified through machine learning?,Advanced Analytics and Predictive Modeling,a685bc76
What are the benefits of more accurate segmentation in consumer analytics?,Advanced Analytics and Predictive Modeling,a685bc76
Is it possible to utilize sentiment analysis for monitoring brand reputation?,Advanced Analytics and Predictive Modeling,8e4ceb4a
How can sentiment analysis assist in evaluating brand perception?,Advanced Analytics and Predictive Modeling,8e4ceb4a
What types of consumer feedback can sentiment analysis analyze for brand reputation?,Advanced Analytics and Predictive Modeling,8e4ceb4a
Can social media mentions be included in sentiment analysis for brand tracking?,Advanced Analytics and Predictive Modeling,8e4ceb4a
In what ways does sentiment analysis help identify changes in brand reputation over time?,Advanced Analytics and Predictive Modeling,8e4ceb4a
What steps do I need to follow to establish a machine learning model in the portal?,Advanced Analytics and Predictive Modeling,c95364eb
Which types of machine learning models can I choose from when setting up in the portal?,Advanced Analytics and Predictive Modeling,c95364eb
How do I select the data for analysis while configuring a machine learning model?,Advanced Analytics and Predictive Modeling,c95364eb
Is it necessary to use historical data for training the machine learning model?,Advanced Analytics and Predictive Modeling,c95364eb
Can you explain the difference between classification and clustering in machine learning models?,Advanced Analytics and Predictive Modeling,c95364eb
What steps should I take to understand the output of a predictive model?,Advanced Analytics and Predictive Modeling,4bdad21d
How can I assess the accuracy of results from a predictive model?,Advanced Analytics and Predictive Modeling,4bdad21d
What factors should I consider when comparing predicted values to actual outcomes?,Advanced Analytics and Predictive Modeling,4bdad21d
In what ways can I evaluate the reliability of my predictive model?,Advanced Analytics and Predictive Modeling,4bdad21d
What do I need to look for in the model's classifications to interpret its results?,Advanced Analytics and Predictive Modeling,4bdad21d
Is it possible to apply predictive modeling techniques for market demand forecasting?,Advanced Analytics and Predictive Modeling,a9fe5fb6
How does predictive modeling analyze historical sales data for demand forecasting?,Advanced Analytics and Predictive Modeling,a9fe5fb6
What are the key drivers of demand identified in predictive modeling?,Advanced Analytics and Predictive Modeling,a9fe5fb6
Can predictive modeling accommodate changes in consumer behavior for forecasting?,Advanced Analytics and Predictive Modeling,a9fe5fb6
How does economic condition impact the forecasts generated by predictive modeling?,Advanced Analytics and Predictive Modeling,a9fe5fb6
What methods are available to compare my brand's performance with competitors?,Competitive Benchmarking,805e450e
In what ways can I measure market share against other brands in my category?,Competitive Benchmarking,805e450e
How can I evaluate consumer loyalty to my brand compared to rival brands?,Competitive Benchmarking,805e450e
What metrics should I analyze to assess sales performance in relation to competitors?,Competitive Benchmarking,805e450e
Are there specific regions or demographics I should focus on for sales analysis?,Competitive Benchmarking,805e450e
How can I monitor the promotions of my competitors and assess their effects?,Competitive Benchmarking,177c6f77
Is it possible to analyze how competitor promotions influence sales volumes?,Competitive Benchmarking,177c6f77
Can your platform help me understand changes in consumer behavior due to competitor promotions?,Competitive Benchmarking,177c6f77
Will I be able to see if promotions lead to customers switching brands?,Competitive Benchmarking,177c6f77
Does your research provide insights on market share changes due to competitor promotions?,Competitive Benchmarking,177c6f77
What types of reports are included in your competitive intelligence offerings?,Competitive Benchmarking,5229ecd3
Can you explain what Promotion Analysis entails in your reports?,Competitive Benchmarking,5229ecd3
How does your company evaluate competitor pricing through your Price Positioning reports?,Competitive Benchmarking,5229ecd3
What information can I find regarding new products through your Innovation Tracking?,Competitive Benchmarking,5229ecd3
Are there specifics on how the effectiveness of promotional activities is assessed?,Competitive Benchmarking,5229ecd3
What methods can be used to monitor the pricing strategies of my competitors?,Competitive Benchmarking,d71ae9c2
In what ways can I analyze the promotional offers made by rival companies?,Competitive Benchmarking,d71ae9c2
How do regional differences affect competitor pricing analysis?,Competitive Benchmarking,d71ae9c2
What specific aspects of competitor pricing should I focus on for effective benchmarking?,Competitive Benchmarking,d71ae9c2
How can competitor insights assist in positioning my products in the market?,Competitive Benchmarking,d71ae9c2
How can I assess my brand's position in the market relative to other companies?,Competitive Benchmarking,58b0cb09
What types of data are utilized for market share comparisons?,Competitive Benchmarking,58b0cb09
Are there specific regions where I can analyze my brand's market performance?,Competitive Benchmarking,58b0cb09
Can consumer surveys contribute to benchmarking my brand against competitors?,Competitive Benchmarking,58b0cb09
What industry resources support the analysis of market share?,Competitive Benchmarking,58b0cb09
What steps do I need to follow to create a competitive benchmarking report?,Competitive Benchmarking,eaeb7e7f
Which elements should I consider when selecting competitors for my report?,Competitive Benchmarking,eaeb7e7f
What specific metrics can I use for comparison in the competitive benchmarking report?,Competitive Benchmarking,eaeb7e7f
How can I choose the regions for my competitive analysis?,Competitive Benchmarking,eaeb7e7f
What types of trends will the report reveal regarding competitors?,Competitive Benchmarking,eaeb7e7f
Is it possible to compare my brand's performance across various regions?,Competitive Benchmarking,14f0f2e0
How can regional benchmarking benefit my brand's strategy?,Competitive Benchmarking,14f0f2e0
What insights can I gain from comparing performance in different geographic areas?,Competitive Benchmarking,14f0f2e0
Can regional analysis help me identify strong and weak markets for my brand?,Competitive Benchmarking,14f0f2e0
Will benchmarking provide data to tailor strategies for specific regions?,Competitive Benchmarking,14f0f2e0
What are the benefits of using competitive benchmarking in marketing strategy development?,Competitive Benchmarking,78cd7ae9
In what ways can competitive benchmarking help identify my brand's weaknesses?,Competitive Benchmarking,78cd7ae9
How does competitive benchmarking allow for adjustments in messaging or targeting?,Competitive Benchmarking,78cd7ae9
Can competitive benchmarking influence promotional activities for better performance?,Competitive Benchmarking,78cd7ae9
What specific improvements can I expect from applying competitive benchmarking insights?,Competitive Benchmarking,78cd7ae9
What types of visual tools can I use to analyze competitive benchmarking data on your platform?,Competitive Benchmarking,ad016d3e
How does your platform help in comparing my brand's performance against competitors?,Competitive Benchmarking,ad016d3e
Can you specify the visualization options available for examining competitive benchmarking data?,Competitive Benchmarking,ad016d3e
What kinds of graphical representations do you provide for market share comparison?,Competitive Benchmarking,ad016d3e
Are there specific features in your platform that assist with visualizing competitive data?,Competitive Benchmarking,ad016d3e
How can I monitor the product launches of my competitors?,Competitive Benchmarking,adfb9d72
What sources of information can I use to track competitor activity?,Competitive Benchmarking,adfb9d72
In what ways can competitor product insights influence my brand strategy?,Competitive Benchmarking,adfb9d72
What role does social media play in monitoring competitor launches?,Competitive Benchmarking,adfb9d72
Are there specific industry reports that would help me track new products from competitors?,Competitive Benchmarking,adfb9d72
What methods are used to gather consumer feedback?,Consumer Sentiment and Feedback,22a27237
In what ways is consumer sentiment tracked on social media?,Consumer Sentiment and Feedback,22a27237
How does the company analyze online product reviews?,Consumer Sentiment and Feedback,22a27237
What role does the consumer panel play in feedback collection?,Consumer Sentiment and Feedback,22a27237
Are there regular surveys for gathering consumer opinions?,Consumer Sentiment and Feedback,22a27237
Is it possible to filter feedback based on specific product categories?,Consumer Sentiment and Feedback,d65fd794
Can I narrow down consumer feedback to a particular brand within a category?,Consumer Sentiment and Feedback,d65fd794
How detailed can I get with the product category filters for feedback?,Consumer Sentiment and Feedback,d65fd794
Are there options to analyze feedback based on different sentiment types?,Consumer Sentiment and Feedback,d65fd794
What types of product categories can I focus on when filtering consumer feedback?,Consumer Sentiment and Feedback,d65fd794
What methods are used to analyze negative feedback on the platform?,Consumer Sentiment and Feedback,8589af30
How does the platform identify recurring problems or complaints in feedback?,Consumer Sentiment and Feedback,8589af30
In what ways can negative feedback highlight areas needing improvement?,Consumer Sentiment and Feedback,8589af30
How is the impact of negative feedback assessed on brand perception?,Consumer Sentiment and Feedback,8589af30
What role does negative feedback play in measuring sales impact?,Consumer Sentiment and Feedback,8589af30
How can I observe shifts in consumer sentiment throughout different periods?,Consumer Sentiment and Feedback,7832d692
What methods do you use to analyze consumer attitudes over time?,Consumer Sentiment and Feedback,7832d692
Is it possible to monitor trends in consumer feedback with your research?,Consumer Sentiment and Feedback,7832d692
Can social media data be incorporated into tracking consumer sentiment?,Consumer Sentiment and Feedback,7832d692
How do product reviews contribute to understanding changes in consumer attitudes?,Consumer Sentiment and Feedback,7832d692
What specific tools does the platform offer for analyzing consumer sentiment?,Consumer Sentiment and Feedback,7609f71c
Can you explain how the sentiment analysis tools visualize trends over time?,Consumer Sentiment and Feedback,7609f71c
Is there a way to generate detailed reports from the sentiment analysis findings?,Consumer Sentiment and Feedback,7609f71c
How does the platform extract sentiment from different types of consumer feedback?,Consumer Sentiment and Feedback,7609f71c
What formats are available for presenting the results of the sentiment analysis?,Consumer Sentiment and Feedback,7609f71c
What methods can I use to gather consumer feedback regarding our new products?,Consumer Sentiment and Feedback,0c303343
In what ways can I assess consumer satisfaction after a product purchase?,Consumer Sentiment and Feedback,0c303343
How can product testing panels be utilized to gain insights on new offerings?,Consumer Sentiment and Feedback,0c303343
What role do online reviews play in understanding consumer sentiment?,Consumer Sentiment and Feedback,0c303343
What are the key areas to focus on when analyzing consumer feedback for improvements?,Consumer Sentiment and Feedback,0c303343
Is it possible to categorize consumer feedback based on demographics?,Consumer Sentiment and Feedback,5b9a0a4c
What demographic factors can I use to analyze consumer feedback?,Consumer Sentiment and Feedback,5b9a0a4c
Can I gain insights into different consumer groups through demographic segmentation?,Consumer Sentiment and Feedback,5b9a0a4c
How will demographic segmentation help in understanding product perception?,Consumer Sentiment and Feedback,5b9a0a4c
