Question,Category,Document
Can you explain what syndicated research entails?,General Information,3e72e1c8
What type of data is included in syndicated research?,General Information,3e72e1c8
Who compiles the findings for syndicated research?,General Information,3e72e1c8
In what industries is syndicated research commonly used?,General Information,3e72e1c8
How can syndicated research benefit multiple clients?,General Information,3e72e1c8
What is the frequency of updates for the syndicated research data?,General Information,7a6f8a30
Are quarterly summaries included with the monthly updates?,General Information,7a6f8a30
Can subscribers access real-time or weekly data updates?,General Information,7a6f8a30
How often can I expect annual summaries to be provided?,General Information,7a6f8a30
Does the update frequency vary based on the subscription level?,General Information,7a6f8a30
What types of Food and Beverages are included in the research coverage?,General Information,e8a77888
Can you specify the Personal Care categories that are part of your research?,General Information,e8a77888
Which Household Cleaning products are addressed in the syndicated research?,General Information,e8a77888
"Are Over-the-Counter Pharmaceuticals included in the research, and if so, what specific products?",General Information,e8a77888
Is there a comprehensive list of all FMCG categories covered in the research?,General Information,e8a77888
What types of companies can find value in this syndicated research coverage?,General Information,bf9b1dd9
Who is the target audience for the research provided by your company?,General Information,bf9b1dd9
Which sectors are likely to benefit from the insights derived from this research?,General Information,bf9b1dd9
What kind of professionals might utilize this research for their work?,General Information,bf9b1dd9
In what ways can different industries leverage the findings from the syndicated research?,General Information,bf9b1dd9
Can you specify which geographic regions are included in the syndicated research coverage?,General Information,5f5990d3
Is there data available for North America in the research findings?,General Information,5f5990d3
Does the research encompass any information from Asia-Pacific?,General Information,5f5990d3
What areas of Europe does the research cover?,General Information,5f5990d3
Is there a consideration for consumer behavior in Latin America and Africa?,General Information,5f5990d3
Is historical data included in the research coverage?,General Information,7570749a
How far back does the historical data go?,General Information,7570749a
What is the maximum timeframe of historical data available?,General Information,7570749a
Can I perform trend analysis with the historical data?,General Information,7570749a
Does the availability of historical data depend on my subscription?,General Information,7570749a
Does the company ensure the privacy of consumer data in its reports?,General Information,3a093e41
What measures are taken to protect consumer privacy in the research?,General Information,3a093e41
Are there any compliance standards followed regarding data protection?,General Information,3a093e41
How does the company handle consumer data while ensuring anonymity?,General Information,3a093e41
Is the research data shared in a way that respects individual privacy rights?,General Information,3a093e41
What distinguishes syndicated research from custom research in terms of its audience?,General Information,10d86de2
Can you explain the primary differences in insights offered by syndicated research and custom research?,General Information,10d86de2
How does the approach of syndicated research differ from that of custom research?,General Information,10d86de2
In what ways does syndicated research provide value to multiple clients simultaneously?,General Information,10d86de2
What kind of business needs does custom research address that syndicated research does not?,General Information,10d86de2
What is the expected number of respondents in your global studies?,General Information,27cb5967
How do you ensure representation in different regions for your global studies?,General Information,27cb5967
Can you provide details on the sample size used in your global research?,General Information,27cb5967
Is there a standard number of participants for your international studies?,General Information,27cb5967
What measures do you take to cover various demographics in your studies?,General Information,27cb5967
Is it possible to buy single reports instead of subscribing?,General Information,41c9bfef
Can I get specific insights by purchasing reports individually?,General Information,41c9bfef
Do I need a subscription to access certain reports?,General Information,41c9bfef
Are there options for acquiring reports without a long-term contract?,General Information,41c9bfef
What are my choices if I only want to purchase one report?,General Information,41c9bfef
How often does the company introduce new research categories?,General Information,cf0a2203
What factors influence the addition of new categories in the research?,General Information,cf0a2203
Are there specific times when new categories are evaluated for inclusion?,General Information,cf0a2203
Is the decision to add categories influenced by consumer trends?,General Information,cf0a2203
Can clients expect updates on new categories yearly?,General Information,cf0a2203
Which sectors of businesses can gain from the insights offered by your syndicated research?,General Information,1b9d38ed
Are there specific industries that find your research beneficial?,General Information,1b9d38ed
Can you provide examples of the types of companies that would utilize this research?,General Information,1b9d38ed
Is your research relevant for businesses in the marketing sector?,General Information,1b9d38ed
How does your syndicated research apply to financial services companies?,General Information,1b9d38ed
Is it permissible to distribute the reports to others within my company?,General Information,486aae19
Can I allow my colleagues to access the research reports?,General Information,486aae19
Are there any limitations on sharing reports among team members?,General Information,486aae19
What are the guidelines for sharing reports internally?,General Information,486aae19
Is external sharing of the reports allowed under the subscription terms?,General Information,486aae19
Can you elaborate on the types of consumer behaviors that are included in the data collection?,General Information,e893543c
Does the research encompass both digital and physical shopping activities?,General Information,e893543c
Are e-commerce transactions part of the consumer purchase behavior analysis?,General Information,e893543c
Will I find information related to mobile app usage in the data collected?,General Information,e893543c
"Is the data collection limited to a specific retail channel, or does it cover multiple channels?",General Information,e893543c
What specific emphasis is placed on emerging markets in the research reports?,General Information,d5391e41
Can you explain how consumer behavior in emerging markets is analyzed?,General Information,d5391e41
Are there particular advantages to studying market opportunities in these regions?,General Information,d5391e41
Do you produce dedicated reports focused solely on emerging market trends?,General Information,d5391e41
How frequently are the reports on emerging markets updated or published?,General Information,d5391e41
Can you explain the methods used to gather data in your research?,General Information,7bc29bfb
What types of surveys are incorporated into your data collection?,General Information,7bc29bfb
How do you utilize loyalty card tracking in your research methodology?,General Information,7bc29bfb
Is social media analysis part of your data gathering process?,General Information,7bc29bfb
What overall approach do you take to understand consumer behavior?,General Information,7bc29bfb
What are the subscription plans that provide access to raw data?,General Information,cc78a115
Is there a way to analyze the raw data more thoroughly?,General Information,cc78a115
Can custom reports be generated using the raw data available?,General Information,cc78a115
Are there any specific requirements to access raw data?,General Information,cc78a115
Will I receive support for understanding the raw data in my reports?,General Information,cc78a115
Can I request a demonstration of the online portal and its features?,General Information,f6be11b2
What does the demo of the online platform include?,General Information,f6be11b2
How can I arrange for a preview of the data access functionalities?,General Information,f6be11b2
Is the demonstration available to all potential clients?,General Information,f6be11b2
What capabilities will be showcased during the demo session?,General Information,f6be11b2
What methods are used to analyze multi-channel shopping behavior?,General Information,bce3ad09
How does the research incorporate data from different shopping platforms?,General Information,bce3ad09
Can you explain how consumer purchase patterns are assessed?,General Information,bce3ad09
What types of channels are considered in the research?,General Information,bce3ad09
How is data from physical stores integrated with online shopping information?,General Information,bce3ad09
Which sectors does the research primarily focus on?,General Information,19139d85
Are there specific industries covered beyond FMCG?,General Information,19139d85
What types of products are included in the FMCG sectors?,General Information,19139d85
Does the research include coverage of retail and e-commerce?,General Information,19139d85
Is there a focus on pharmaceuticals in the research coverage?,General Information,19139d85
What methods are utilized to gather consumer purchase behavior data?,Data Collection Methodology,82dac879
How does Point-of-Sale data contribute to understanding consumer habits?,Data Collection Methodology,82dac879
Can you explain the role of consumer panels in data collection?,Data Collection Methodology,82dac879
How is loyalty card data used to track purchasing behavior?,Data Collection Methodology,82dac879
What type of data is derived from online purchase tracking?,Data Collection Methodology,82dac879
What is the overall size of the consumer panel used for research?,Data Collection Methodology,52a82dcc
How many households are included in the consumer panel for data collection?,Data Collection Methodology,52a82dcc
Can you elaborate on the diversity of the demographic segments in the consumer panel?,Data Collection Methodology,52a82dcc
What measures are taken to ensure the data reflects the broader population?,Data Collection Methodology,52a82dcc
Is the consumer panel composed of households from various geographic regions?,Data Collection Methodology,52a82dcc
What methods are used to ensure the accuracy of the data collected?,Data Collection Methodology,0a371796
How do you validate the panel data for research purposes?,Data Collection Methodology,0a371796
Can you explain the process of cross-referencing in your data collection?,Data Collection Methodology,0a371796
What statistical techniques do you employ to address potential inaccuracies?,Data Collection Methodology,0a371796
How often are quality checks performed on the collected data?,Data Collection Methodology,0a371796
What procedures do you implement to identify emerging categories in the market?,Data Collection Methodology,5124314a
How often do you adjust your data collection methods to reflect new market trends?,Data Collection Methodology,5124314a
In what way are new categories integrated into your existing research frameworks?,Data Collection Methodology,5124314a
Can you explain how you ensure thorough coverage of newly relevant categories?,Data Collection Methodology,5124314a
What steps do you take to continuously monitor the market for new developments?,Data Collection Methodology,5124314a
What methods are utilized to gather data for research purposes?,Data Collection Methodology,6e3b362d
Can you explain the various survey formats employed in your research?,Data Collection Methodology,6e3b362d
What are the different ways you collect consumer opinions through surveys?,Data Collection Methodology,6e3b362d
Are online surveys a part of your data collection strategies?,Data Collection Methodology,6e3b362d
Do you conduct interviews or focus groups as part of your research process?,Data Collection Methodology,6e3b362d
What methods are utilized to monitor online shopping behavior?,Data Collection Methodology,576a7af0
Can you explain the types of data collected regarding e-commerce transactions?,Data Collection Methodology,576a7af0
What role do consumer surveys play in understanding shopping habits?,Data Collection Methodology,576a7af0
How do web analytics contribute to insights about online retail interactions?,Data Collection Methodology,576a7af0
What are the primary sources of data for assessing online shopping trends?,Data Collection Methodology,576a7af0
What types of demographic information are collected in your research studies?,Data Collection Methodology,c51478f7
Which specific age groups are targeted in the demographic analysis?,Data Collection Methodology,c51478f7
Is income level part of the data gathered for your research segments?,Data Collection Methodology,c51478f7
Do you provide insights into educational background in your findings?,Data Collection Methodology,c51478f7
How do you account for geographic differences in your demographic data?,Data Collection Methodology,c51478f7
What is the frequency at which surveys are performed by your company?,Data Collection Methodology,7a0e95d3
Are there any specific times when additional surveys take place?,Data Collection Methodology,7a0e95d3
Do you conduct surveys more often during certain shopping periods?,Data Collection Methodology,7a0e95d3
How often can I expect new survey data to be available?,Data Collection Methodology,7a0e95d3
Is there a process for conducting surveys based on current market trends?,Data Collection Methodology,7a0e95d3
What role does loyalty card data play in your research practices?,Data Collection Methodology,0ea549ca
In what ways can loyalty card data help analyze consumer behavior?,Data Collection Methodology,0ea549ca
How does loyalty card data contribute to understanding brand loyalty?,Data Collection Methodology,0ea549ca
Can you explain how loyalty card data influences purchase frequency analysis?,Data Collection Methodology,0ea549ca
What insights can be gained regarding promotions from loyalty card data?,Data Collection Methodology,0ea549ca
What procedures are in place to ensure the accuracy of the research data collected?,Data Collection Methodology,ab5ff3b3
Can you explain how survey responses are verified against actual sales data?,Data Collection Methodology,ab5ff3b3
What statistical methods do you utilize to check for data consistency?,Data Collection Methodology,ab5ff3b3
How do you handle and eliminate outlier responses from the dataset?,Data Collection Methodology,ab5ff3b3
What steps are involved in the data cleaning process after collection?,Data Collection Methodology,ab5ff3b3
How do focus groups contribute to the overall data collection process?,Data Collection Methodology,eccdee8f
What type of insights can be gained from focus group discussions?,Data Collection Methodology,eccdee8f
In what ways do focus groups enhance survey and POS tracking data?,Data Collection Methodology,eccdee8f
What are the specific consumer aspects that focus groups help to understand?,Data Collection Methodology,eccdee8f
Why are qualitative insights important in addition to quantitative data?,Data Collection Methodology,eccdee8f
What techniques are employed to monitor mobile app interactions?,Data Collection Methodology,413bb4ae
In what ways are in-app purchases analyzed to understand consumer behavior?,Data Collection Methodology,413bb4ae
How do you gather insights on user engagement with promotional materials within the app?,Data Collection Methodology,413bb4ae
What specific metrics are used to assess mobile shopping habits?,Data Collection Methodology,413bb4ae
Can you explain the methodology for collecting data on mobile app usage?,Data Collection Methodology,413bb4ae
Can you explain the geographic areas from which you gather data for your research?,Data Collection Methodology,05db1ff8
How do you ensure your data collection represents different types of communities?,Data Collection Methodology,05db1ff8
What regions are included in your data collection methodology?,Data Collection Methodology,05db1ff8
Is there a focus on specific types of regions when collecting data?,Data Collection Methodology,05db1ff8
How is diversity represented in the geographic coverage of your research?,Data Collection Methodology,05db1ff8
What specific time periods are used to measure purchase frequency?,Data Collection Methodology,00a96074
Which data sources help in tracking consumer purchase frequency?,Data Collection Methodology,00a96074
Are loyalty cards included in the data collection for purchase frequency?,Data Collection Methodology,00a96074
Can surveys provide insights into how often consumers buy products?,Data Collection Methodology,00a96074
How does point-of-sale data contribute to measuring purchase frequency?,Data Collection Methodology,00a96074
How does your company utilize social media to gather data?,Data Collection Methodology,4e487fa5
What insights can be gained from analyzing social media platforms?,Data Collection Methodology,4e487fa5
How is consumer sentiment measured through social media?,Data Collection Methodology,4e487fa5
In what ways does social media help in identifying market trends?,Data Collection Methodology,4e487fa5
What types of consumer attitudes can be captured from social media analysis?,Data Collection Methodology,4e487fa5
What role does household size play in your research findings?,Data Collection Methodology,7d4a3802
How does the segmentation of household size impact data interpretation?,Data Collection Methodology,7d4a3802
In what ways does family size affect consumer shopping habits according to your data?,Data Collection Methodology,7d4a3802
Can you explain how household size influences product choices in your studies?,Data Collection Methodology,7d4a3802
What specific aspects of purchase behavior are analyzed concerning household size?,Data Collection Methodology,7d4a3802
What methodology is used to assess the impact of promotions on consumer behavior?,Data Collection Methodology,ddcb3ef3
Can you explain the process for analyzing promotional effects over time?,Data Collection Methodology,ddcb3ef3
What sources of data do you utilize to evaluate promotional activities?,Data Collection Methodology,ddcb3ef3
How do you incorporate consumer feedback in measuring promotional success?,Data Collection Methodology,ddcb3ef3
Is there a difference in measurement techniques for different types of promotions?,Data Collection Methodology,ddcb3ef3
What techniques are employed to integrate data from various sources in the research?,Data Collection Methodology,175ddb62
"Can you explain how POS data, survey responses, and loyalty card data are combined?",Data Collection Methodology,175ddb62
What process is used to create a unified dataset for analysis?,Data Collection Methodology,175ddb62
How does the integration of different data sources enhance the research findings?,Data Collection Methodology,175ddb62
What is the role of data fusion in your data collection methodology?,Data Collection Methodology,175ddb62
What processes are implemented to maintain data integrity during collection?,Data Collection Methodology,f34adc6d
Can you elaborate on how errors in the data are addressed?,Data Collection Methodology,f34adc6d
What techniques are utilized to handle duplicate records?,Data Collection Methodology,f34adc6d
How do you ensure uniformity in data formats across your datasets?,Data Collection Methodology,f34adc6d
What strategies are in place for managing missing data points?,Data Collection Methodology,f34adc6d
What methods are used to identify outliers in the data collection process?,Data Collection Methodology,b565c775
How does the company decide to correct or investigate outliers?,Data Collection Methodology,b565c775
What criteria are used to determine if a behavior is unusual but valid?,Data Collection Methodology,b565c775
Is there a standardized approach for handling outliers across different studies?,Data Collection Methodology,b565c775
How often are outliers reviewed after initial identification?,Data Collection Methodology,b565c775
What is the process for conducting longitudinal data analysis in your research?,Data Collection Methodology,6cb2e5e5
How do you track consumers over time in your studies?,Data Collection Methodology,6cb2e5e5
What benefits does longitudinal analysis offer for understanding consumer behavior?,Data Collection Methodology,6cb2e5e5
In what ways can longitudinal data reveal changes in preferences?,Data Collection Methodology,6cb2e5e5
Can you explain how you monitor trends over time using your methodology?,Data Collection Methodology,6cb2e5e5
How do behavioral economics principles enhance your research methodologies?,Data Collection Methodology,0c3596ef
Can you explain how psychological factors shape consumer decision-making in your studies?,Data Collection Methodology,0c3596ef
What impact do price framing and promotions have on research results?,Data Collection Methodology,0c3596ef
How does your research incorporate social proof in understanding consumer behavior?,Data Collection Methodology,0c3596ef
In what ways does your research address the influence of psychological factors on purchases?,Data Collection Methodology,0c3596ef
What methods are used to monitor new product launches?,Data Collection Methodology,f5c05b0c
Can you explain the types of data collected for product tracking?,Data Collection Methodology,f5c05b0c
How does social media contribute to understanding product launches?,Data Collection Methodology,f5c05b0c
What insights can be gained from the data on product adoption?,Data Collection Methodology,f5c05b0c
In what ways is competitive positioning assessed during product launches?,Data Collection Methodology,f5c05b0c
What methods are employed to assess how often consumers repurchase products?,Data Collection Methodology,6d418fd0
Can you explain the data sources utilized for tracking repeat purchases?,Data Collection Methodology,6d418fd0
How does the company differentiate between new and repeat buyers?,Data Collection Methodology,6d418fd0
What role do loyalty cards play in measuring buying behavior?,Data Collection Methodology,6d418fd0
Are surveys part of the methodology for understanding purchasing patterns?,Data Collection Methodology,6d418fd0
What specific techniques are employed for analyzing trends in the data?,Data Collection Methodology,08bc4285
Can you explain the approach taken to identify long-term patterns?,Data Collection Methodology,08bc4285
Which statistical models are utilized for forecasting future trends?,Data Collection Methodology,08bc4285
How does your methodology ensure accurate trend analysis?,Data Collection Methodology,08bc4285
What are the key features of the trend analysis methods you apply?,Data Collection Methodology,08bc4285
Can you explain how seasonal changes are incorporated into your research data?,Data Collection Methodology,0a41f010
What measures do you take to adjust for seasonal consumer behavior shifts?,Data Collection Methodology,0a41f010
How does your methodology ensure accurate analysis during specific seasonal events?,Data Collection Methodology,0a41f010
"Are there particular periods, like holidays, that you focus on for seasonal adjustments?",Data Collection Methodology,0a41f010
In what ways does seasonality affect the overall trend analysis in your reports?,Data Collection Methodology,0a41f010
What specific indicators are used to evaluate brand loyalty in your research?,Data Collection Methodology,b5f1a05e
How do you analyze the behavior of consumers when they switch brands?,Data Collection Methodology,b5f1a05e
Can you explain the role of loyalty cards in measuring brand loyalty?,Data Collection Methodology,b5f1a05e
What types of data sources do you utilize for assessing consumer sentiment?,Data Collection Methodology,b5f1a05e
How often is brand loyalty updated in your reports?,Data Collection Methodology,b5f1a05e
How are in-store observations utilized in your data collection process?,Data Collection Methodology,c9315368
What types of insights can be gained from observing consumers in stores?,Data Collection Methodology,c9315368
In what ways do in-store observations enhance quantitative data collection?,Data Collection Methodology,c9315368
Can you explain the significance of studying consumer behavior through in-store observations?,Data Collection Methodology,c9315368
How do shopping patterns and product interactions get analyzed from in-store observations?,Data Collection Methodology,c9315368
What methods are employed to track product trial behavior in the research?,Data Collection Methodology,93bffeab
Can you explain how new product purchases are monitored during this process?,Data Collection Methodology,93bffeab
How is consumer satisfaction evaluated after a product trial?,Data Collection Methodology,93bffeab
What analysis is done on subsequent purchase behavior following initial trials?,Data Collection Methodology,93bffeab
Are follow-up surveys a standard part of assessing product trial experiences?,Data Collection Methodology,93bffeab
What methods are utilized to gather competitive pricing information?,Data Collection Methodology,9e78a28a
In what ways can pricing strategies across different brands be compared?,Data Collection Methodology,9e78a28a
Could you explain the role of store audits in data collection?,Data Collection Methodology,9e78a28a
