Question,Category,Document
How is online price tracking integrated into your research?,Data Collection Methodology,9e78a28a
What types of data analysis are performed on POS information?,Data Collection Methodology,9e78a28a
Why are respondent incentives crucial in survey participation?,Data Collection Methodology,6659753f
How do incentives affect the accuracy of survey data?,Data Collection Methodology,6659753f
What types of incentives are commonly used in surveys?,Data Collection Methodology,6659753f
In what ways do incentives contribute to obtaining a representative sample?,Data Collection Methodology,6659753f
Can inadequate incentives lead to biased survey results?,Data Collection Methodology,6659753f
What methods are used to track interactions with both digital and traditional media?,Data Collection Methodology,d22ba152
Can you explain how cross-media analysis works in tracking media engagement?,Data Collection Methodology,d22ba152
What insights can be derived from examining consumer interactions with various media types?,Data Collection Methodology,d22ba152
How does the tracking of online ads differ from that of TV commercials or print media?,Data Collection Methodology,d22ba152
What benefits does the cross-media analysis provide in understanding media effectiveness?,Data Collection Methodology,d22ba152
How does AI improve the efficiency of data collection methods?,Data Collection Methodology,836b9000
In what ways does AI enhance the accuracy of data analysis?,Data Collection Methodology,836b9000
Can you explain how AI contributes to sentiment analysis specifically?,Data Collection Methodology,836b9000
What specific tasks in social media monitoring are automated by AI?,Data Collection Methodology,836b9000
How does predictive modeling function within the context of data collection?,Data Collection Methodology,836b9000
What steps are involved in the creation of customer journey maps?,Data Collection Methodology,19e64457
Which types of consumer interactions are analyzed for mapping?,Data Collection Methodology,19e64457
How does the analysis of touchpoints contribute to understanding the consumer experience?,Data Collection Methodology,19e64457
What sources of data are used in developing customer journey maps?,Data Collection Methodology,19e64457
Can you explain the importance of a comprehensive view in customer journey mapping?,Data Collection Methodology,19e64457
What methods are used to track consumer switching between brands?,Data Collection Methodology,425d5dd2
In what scenarios do consumers typically change their preferred brands?,Data Collection Methodology,425d5dd2
How does your research account for price changes affecting brand loyalty?,Data Collection Methodology,425d5dd2
What role do promotions play in influencing product substitution behaviors?,Data Collection Methodology,425d5dd2
How do availability issues impact consumers' brand choices?,Data Collection Methodology,425d5dd2
How does your company study the effect of packaging on buying decisions?,Data Collection Methodology,039dddb8
What methodologies are employed to assess consumer behavior regarding packaging?,Data Collection Methodology,039dddb8
Can you elaborate on the types of data collected for packaging research?,Data Collection Methodology,039dddb8
Which specific aspects of packaging influence consumer choices?,Data Collection Methodology,039dddb8
What research methods help analyze the relationship between packaging and sales?,Data Collection Methodology,039dddb8
What methods are used to keep track of out-of-stock situations?,Data Collection Methodology,048d6e15
How does the company gather information about stock availability?,Data Collection Methodology,048d6e15
What types of data contribute to understanding out-of-stock situations?,Data Collection Methodology,048d6e15
How are retailer reports utilized in monitoring stock issues?,Data Collection Methodology,048d6e15
In what ways does consumer feedback play a role in identifying out-of-stock situations?,Data Collection Methodology,048d6e15
What metrics are used to measure the success of marketing campaigns?,Data Collection Methodology,0dc5788a
Which data sources contribute to assessing campaign effectiveness?,Data Collection Methodology,0dc5788a
How are changes in consumer behavior tracked during a marketing campaign?,Data Collection Methodology,0dc5788a
In what ways is brand awareness evaluated through the data collection?,Data Collection Methodology,0dc5788a
What timeframes are considered when analyzing marketing campaign results?,Data Collection Methodology,0dc5788a
What methods are used to monitor consumer preferences related to sustainable products?,Data Collection Methodology,d3c37f77
In what ways are surveys incorporated into the tracking of sustainable product preferences?,Data Collection Methodology,d3c37f77
How do sales data contribute to understanding consumer choices regarding sustainability?,Data Collection Methodology,d3c37f77
What role does social media analysis play in tracking preferences for eco-friendly products?,Data Collection Methodology,d3c37f77
Which specific factors are considered when analyzing consumer interest in sustainable items?,Data Collection Methodology,d3c37f77
What are the main techniques used to gather data from online marketplaces?,Data Collection Methodology,c7c8d1d6
Could you explain the types of insights gained from analyzing transaction data?,Data Collection Methodology,c7c8d1d6
How does web scraping contribute to understanding product performance?,Data Collection Methodology,c7c8d1d6
What role do consumer reviews play in your data collection process?,Data Collection Methodology,c7c8d1d6
How do you assess pricing strategies using the collected marketplace data?,Data Collection Methodology,c7c8d1d6
How does geolocation data help in analyzing consumer shopping habits?,Data Collection Methodology,527ab610
In what ways does location data enhance understanding of shopping patterns?,Data Collection Methodology,527ab610
What insights can be gained from studying consumers' travel distances for purchases?,Data Collection Methodology,527ab610
How do location-based promotions influence consumer behavior according to the research?,Data Collection Methodology,527ab610
What is the significance of regional variations in shopping patterns as revealed by geolocation data?,Data Collection Methodology,527ab610
What methods are used to analyze consumer behavior during economic downturns?,Data Collection Methodology,b35febbf
How are spending habits tracked in the research?,Data Collection Methodology,b35febbf
What types of data are collected to assess brand loyalty?,Data Collection Methodology,b35febbf
Can you explain how economic indicators are utilized in your analysis?,Data Collection Methodology,b35febbf
What specific product preferences are examined in the research?,Data Collection Methodology,b35febbf
What measures are taken to ensure consumer data privacy during research?,Data Collection Methodology,e842bbd5
How is consumer data anonymized in your research studies?,Data Collection Methodology,e842bbd5
What regulations do you comply with to protect data privacy?,Data Collection Methodology,e842bbd5
How do you obtain consent for collecting consumer data?,Data Collection Methodology,e842bbd5
What steps are involved in addressing data privacy concerns?,Data Collection Methodology,e842bbd5
What methods are used to analyze household spending patterns?,Data Collection Methodology,094c4275
How is spending tracked across various product categories?,Data Collection Methodology,094c4275
What types of data sources are utilized in the analysis?,Data Collection Methodology,094c4275
How are different income levels accounted for in the expenditure analysis?,Data Collection Methodology,094c4275
Which demographic segments are considered when studying household expenditure?,Data Collection Methodology,094c4275
What methods are used to evaluate consumer opinions on advertising?,Data Collection Methodology,852874dc
In what ways are surveys utilized to gather data on consumer attitudes toward ads?,Data Collection Methodology,852874dc
How is social media involved in measuring consumer reactions to advertising?,Data Collection Methodology,852874dc
What specific factors are analyzed to understand consumer perception of advertisements?,Data Collection Methodology,852874dc
How does the research assess the impact of advertising on purchase decisions?,Data Collection Methodology,852874dc
What specific metrics are used to assess the impact of product recalls on sales?,Data Collection Methodology,6886286e
How does consumer sentiment influence the analysis of product recall effects?,Data Collection Methodology,6886286e
In what ways do social media and surveys contribute to monitoring recall impacts?,Data Collection Methodology,6886286e
What data sources are utilized to gauge changes in consumer trust after a recall?,Data Collection Methodology,6886286e
Can you explain how POS data plays a role in tracking the consequences of product recalls?,Data Collection Methodology,6886286e
What types of observations are conducted to understand impulse buying behavior?,Data Collection Methodology,92657baf
How does sales data contribute to the analysis of impulse purchases?,Data Collection Methodology,92657baf
In what ways are consumer surveys utilized in studying impulse buying?,Data Collection Methodology,92657baf
Which elements are considered crucial when analyzing store environments for impulse buying?,Data Collection Methodology,92657baf
How do promotional displays impact consumer purchasing behavior in stores?,Data Collection Methodology,92657baf
What methods are employed to gather consumer opinions on product quality?,Data Collection Methodology,f3e9d595
Can you describe the process used for collecting feedback from consumers?,Data Collection Methodology,f3e9d595
In what ways is customer satisfaction measured regarding product quality?,Data Collection Methodology,f3e9d595
How does the company analyze responses related to product reviews?,Data Collection Methodology,f3e9d595
What role does social media play in assessing consumer feedback on products?,Data Collection Methodology,f3e9d595
How does psychographic data contribute to understanding consumer behavior in your research?,Data Collection Methodology,712e98a1
What types of psychographic information do you collect during your research process?,Data Collection Methodology,712e98a1
In what ways does psychographic data complement demographic information in your studies?,Data Collection Methodology,712e98a1
Can you explain how lifestyle and values influence consumer segmentation in your research?,Data Collection Methodology,712e98a1
Why is it important to include personality traits in your analysis of consumer preferences?,Data Collection Methodology,712e98a1
What data sources are utilized to gauge the effect of celebrity endorsements on brands?,Data Collection Methodology,19795afe
In what ways does your research assess changes in brand awareness due to celebrity endorsements?,Data Collection Methodology,19795afe
How do you determine the influence of celebrity endorsements on purchase intent among consumers?,Data Collection Methodology,19795afe
What metrics are considered when analyzing sales volume related to celebrity endorsements?,Data Collection Methodology,19795afe
Can you explain how surveys and social media contribute to measuring endorsement impacts?,Data Collection Methodology,19795afe
What methods are employed to analyze consumer behavior during holidays?,Data Collection Methodology,74e6f62f
How are spending patterns tracked in holiday research?,Data Collection Methodology,74e6f62f
What data sources contribute to the analysis of product preferences?,Data Collection Methodology,74e6f62f
How is shopping frequency measured during holiday seasons?,Data Collection Methodology,74e6f62f
Are surveys included in the data collection for holiday consumer behavior?,Data Collection Methodology,74e6f62f
What methods are used to assess consumer trust in different brands?,Data Collection Methodology,bf027584
How do you analyze brand sentiment in your research?,Data Collection Methodology,bf027584
What elements contribute to the measurement of consumer loyalty?,Data Collection Methodology,bf027584
In what ways do product quality and customer service affect brand trust?,Data Collection Methodology,bf027584
How are ethical practices taken into account when measuring trust in brands?,Data Collection Methodology,bf027584
What methods are used to monitor food preferences in different regions?,Data Collection Methodology,99055f79
Can you explain how sales data contributes to understanding local tastes?,Data Collection Methodology,99055f79
How do consumer surveys aid in tracking food preferences regionally?,Data Collection Methodology,99055f79
In what ways does social media analysis enhance insights into food trends?,Data Collection Methodology,99055f79
How are seasonal variations in food preferences identified and analyzed?,Data Collection Methodology,99055f79
What methods are used to gather data on health and wellness consumer trends?,Data Collection Methodology,bf22c8e5
Can you explain the types of data sources utilized for your research on wellness?,Data Collection Methodology,bf22c8e5
How do you incorporate social media insights into your consumer trend analysis?,Data Collection Methodology,bf22c8e5
What specific factors are examined in relation to health and wellness trends?,Data Collection Methodology,bf22c8e5
Are there particular products or services you focus on when collecting data in this area?,Data Collection Methodology,bf22c8e5
What processes are in place to ensure consistent data quality across various markets?,Data Collection Methodology,ab1c9749
How often are audits conducted to verify the integrity of the data collected?,Data Collection Methodology,ab1c9749
Can you explain how regional differences are accounted for in the data collection process?,Data Collection Methodology,ab1c9749
What measures are taken to calibrate data for accuracy across different regions?,Data Collection Methodology,ab1c9749
How do these practices contribute to obtaining reliable insights from the research?,Data Collection Methodology,ab1c9749
What methods are used to analyze consumer behavior regarding premium products?,Data Collection Methodology,6d12f648
How do you measure brand loyalty in your research on premium products?,Data Collection Methodology,6d12f648
Can you explain how purchase frequency is tracked for premium items?,Data Collection Methodology,6d12f648
What role does price sensitivity play in your analysis of consumer interactions with premium products?,Data Collection Methodology,6d12f648
Which data sources contribute to the analysis of premium product consumer behavior?,Data Collection Methodology,6d12f648
What methods are used to track consumer preferences between local and global brands?,Data Collection Methodology,c3d6a2c0
How do you gather insights on brand perception regarding local versus global brands?,Data Collection Methodology,c3d6a2c0
Can you explain the role of surveys in understanding consumer brand loyalty?,Data Collection Methodology,c3d6a2c0
What types of data contribute to analyzing regional variations in brand preferences?,Data Collection Methodology,c3d6a2c0
How does social media analysis factor into tracking consumer preferences for brands?,Data Collection Methodology,c3d6a2c0
How does data triangulation enhance the overall quality of research findings?,Data Collection Methodology,70ec7b0b
What types of sources are typically involved in the data triangulation process?,Data Collection Methodology,70ec7b0b
Why is it essential to verify research results using multiple data sources?,Data Collection Methodology,70ec7b0b
How can the accuracy of research be affected by the lack of data triangulation?,Data Collection Methodology,70ec7b0b
In what ways does data triangulation contribute to the reliability of research outcomes?,Data Collection Methodology,70ec7b0b
What methods are used to analyze consumer behavior during the launch of new products?,Data Collection Methodology,b82b711a
How do you track initial sales and repeat purchases for new products?,Data Collection Methodology,b82b711a
What sources of data do you utilize to assess consumer feedback?,Data Collection Methodology,b82b711a
How is social media incorporated into the analysis of consumer reactions to new products?,Data Collection Methodology,b82b711a
Can you explain how POS systems play a role in understanding consumer behavior?,Data Collection Methodology,b82b711a
What process is used to ensure representation in the research data?,Data Collection Methodology,08fe1eb5
How frequently is the sample composition revised to reflect population changes?,Data Collection Methodology,08fe1eb5
In what ways does the company track demographic changes over time?,Data Collection Methodology,08fe1eb5
How does the methodology adapt to shifts in the population structure?,Data Collection Methodology,08fe1eb5
What measures are taken to maintain the relevance of the research findings?,Data Collection Methodology,08fe1eb5
What methods are used to analyze consumer behavior related to value-oriented products?,Data Collection Methodology,a81ce228
How do you measure price sensitivity among consumers?,Data Collection Methodology,a81ce228
What data sources inform your analysis of brand switching behavior?,Data Collection Methodology,a81ce228
In what ways do POS systems contribute to understanding purchasing frequency?,Data Collection Methodology,a81ce228
"Are surveys utilized in your research on value-oriented products, and if so, how?",Data Collection Methodology,a81ce228
What methods are employed to track seasonal beverage consumption trends?,Data Collection Methodology,1425ca13
How do sales data contribute to understanding beverage preferences over seasons?,Data Collection Methodology,1425ca13
In what ways do consumer surveys influence the analysis of beverage consumption trends?,Data Collection Methodology,1425ca13
How do weather patterns affect insights into beverage consumption?,Data Collection Methodology,1425ca13
What factors are considered when assessing seasonal trends in beverage preferences?,Data Collection Methodology,1425ca13
Can you explain how experimental research contributes to understanding consumer behavior?,Data Collection Methodology,2caf912a
What techniques are used in controlled experiments during data collection?,Data Collection Methodology,2caf912a
How does A/B testing fit into the overall data collection process?,Data Collection Methodology,2caf912a
What types of hypotheses are typically tested in experimental research?,Data Collection Methodology,2caf912a
In what ways can experimental research inform product development and marketing strategies?,Data Collection Methodology,2caf912a
What methods are used to analyze the effects of digital transformation on how consumers behave?,Data Collection Methodology,4c32c054
In what ways are online shopping habits tracked during research?,Data Collection Methodology,4c32c054
How does the company gather data on mobile app usage in its studies?,Data Collection Methodology,4c32c054
What role do surveys play in understanding consumer behavior changes?,Data Collection Methodology,4c32c054
Can you explain how POS systems contribute to the analysis of digital payment adoption?,Data Collection Methodology,4c32c054
What methods are used to assess consumer behavior regarding eco-friendly products?,Data Collection Methodology,a6344634
How do you gather data on sales trends related to eco-friendly items?,Data Collection Methodology,a6344634
In what ways do consumer surveys contribute to understanding eco-friendly product preferences?,Data Collection Methodology,a6344634
How is social media sentiment utilized in analyzing eco-friendly consumer behavior?,Data Collection Methodology,a6344634
What specific factors are considered when studying consumer attitudes toward sustainability in products?,Data Collection Methodology,a6344634
What methods are used to assess consumer behavior as economies recover?,Data Collection Methodology,d0bbb068
How are spending patterns tracked during economic recovery periods?,Data Collection Methodology,d0bbb068
What role do surveys play in understanding brand loyalty during recovery?,Data Collection Methodology,d0bbb068
How is product preference data collected in the context of economic recovery?,Data Collection Methodology,d0bbb068
Which economic indicators are relevant to analyzing consumer behavior post-recession?,Data Collection Methodology,d0bbb068
What methods are employed to monitor consumer preferences in the convenience foods sector?,Data Collection Methodology,c54cc76f
In what ways does the company gather data on convenience food sales?,Data Collection Methodology,c54cc76f
How are consumer attitudes regarding convenience foods assessed?,Data Collection Methodology,c54cc76f
What specific factors are considered when analyzing consumer preferences for convenience foods?,Data Collection Methodology,c54cc76f
Does the company utilize social media to understand trends in convenience food consumption?,Data Collection Methodology,c54cc76f
What methods are used to analyze consumer behavior in relation to trade promotions?,Data Collection Methodology,e6d6994b
How do you measure changes in purchase frequency due to trade promotions?,Data Collection Methodology,e6d6994b
What role do loyalty cards play in analyzing consumer behavior?,Data Collection Methodology,e6d6994b
How is brand switching evaluated in the context of trade promotions?,Data Collection Methodology,e6d6994b
What types of data sources are utilized for understanding stockpiling behavior?,Data Collection Methodology,e6d6994b
What metrics are considered when evaluating influencer marketing effectiveness?,Data Collection Methodology,6417ee7d
Can you explain how brand awareness impacts influencer marketing outcomes?,Data Collection Methodology,6417ee7d
What types of data sources are utilized in the analysis of influencer marketing?,Data Collection Methodology,6417ee7d
How do engagement metrics contribute to understanding influencer campaign success?,Data Collection Methodology,6417ee7d
In what ways are surveys involved in measuring influencer marketing performance?,Data Collection Methodology,6417ee7d
What methods are used to track consumer attitudes towards digital payment systems?,Data Collection Methodology,87fe883c
Can you explain how surveys contribute to understanding digital payment preferences?,Data Collection Methodology,87fe883c
How do mobile app analytics aid in tracking consumer behavior regarding digital payments?,Data Collection Methodology,87fe883c
What role does transaction data play in analyzing digital payment adoption?,Data Collection Methodology,87fe883c
Are there specific barriers to digital payment usage identified through your research methods?,Data Collection Methodology,87fe883c
What methods are used to track consumer behavior related to subscription services?,Data Collection Methodology,ce2f5e34
In what ways are subscription rates monitored within the research?,Data Collection Methodology,ce2f5e34
How are renewal patterns of subscription services assessed?,Data Collection Methodology,ce2f5e34
What sources contribute to understanding customer satisfaction in this context?,Data Collection Methodology,ce2f5e34
What type of data is collected to analyze consumer behavior towards subscriptions?,Data Collection Methodology,ce2f5e34
What methods does the company use to monitor consumer preferences for organic products?,Data Collection Methodology,8f4d03ec
Which data sources are utilized to gather information on organic product consumption?,Data Collection Methodology,8f4d03ec
How does social media contribute to understanding consumer preferences for organic items?,Data Collection Methodology,8f4d03ec
What factors are considered when analyzing consumer preferences for organic products?,Data Collection Methodology,8f4d03ec
Are consumer surveys a part of the methodology for tracking preferences related to organic goods?,Data Collection Methodology,8f4d03ec
What methods are used to analyze the effectiveness of loyalty programs?,Data Collection Methodology,73c573ef
How do you track changes in consumer purchase behavior related to loyalty programs?,Data Collection Methodology,73c573ef
What sources of data inform your analysis of loyalty program impacts?,Data Collection Methodology,73c573ef
In what ways is brand loyalty measured in your research?,Data Collection Methodology,73c573ef
How do you assess redemption rates in your loyalty programs study?,Data Collection Methodology,73c573ef
What data sources are utilized to analyze consumer behavior towards private label products?,Data Collection Methodology,88de04c0
How is brand switching behavior assessed in the context of private label products?,Data Collection Methodology,88de04c0
In what ways does price sensitivity factor into consumer analysis for private labels?,Data Collection Methodology,88de04c0
What role do POS systems play in the analysis of consumer behavior?,Data Collection Methodology,88de04c0
Are surveys and loyalty cards significant in understanding consumer trends for private label products?,Data Collection Methodology,88de04c0
What methods are used to analyze the effects of new regulations on consumer behavior?,Data Collection Methodology,748ca43e
How do surveys contribute to the understanding of consumer reactions to regulations?,Data Collection Methodology,748ca43e
In what ways does tracking product availability help assess regulatory impact?,Data Collection Methodology,748ca43e
What type of data is collected from POS systems for analysis?,Data Collection Methodology,748ca43e
How do industry reports factor into the analysis of consumer behavior changes?,Data Collection Methodology,748ca43e
